A1-NOUN-660,A1,,"""<span class=""""der"""">der</span> Rock [sound:googletts-5ff47a03-b3a7de71-b9a9d8d9-66bc6d75-b355ce9c.mp3]""",,Skirt [sound:googletts-2a6f3d4e-60eddfc9-5bfd0378-4e6fb706-5f0105a4.mp3],"As a schoolgirl, I had to wear a skirt.",Als Schülerin musste ich einen Rock tragen.,
A1-NOUN-661,A1,,"""<span class=""""der"""">der</span> Roman [sound:googletts-59f6151a-4b2522a5-c49a3d3e-22986088-27c1406d.mp3]""",,Romance [sound:googletts-043da747-4a232fa7-aa4062ab-aa76ace1-170c3022.mp3],The play depicts the romance between two young lovers.,There are many Roman ruins all over Europe.,
A1-NOUN-662,A1,,"""<span class=""""der"""">der</span> Rücken [sound:googletts-d2b4835e-5b4b3ce2-aa35c32c-d2226cf1-fd5094a3.mp3]""",,Back [sound:googletts-6928fc97-2e84bebe-0d25aad2-43aa0bd9-a42fe723.mp3],I put the book back on the shelf.,Ich stellte das Buch zurück ins Regal.,
A1-NOUN-663,A1,,"""<span class=""""der"""">der</span> Rucksack [sound:googletts-5f4210b9-6f144598-e6100be5-000043d4-d66e629b.mp3]""",,Backpack [sound:googletts-e71f71e7-92322877-c5f51232-ddfe026e-08e10c83.mp3],A light backpack is preferable to a heavy suitcase.,Ein leichter Rucksack ist einem schweren Koffer vorzuziehen.,
A1-NOUN-664,A1,,"""<span class=""""der"""">der</span> Rundfunk [sound:googletts-a1810c58-56f67caf-a6f53ce8-6907dcb4-c309f8ca.mp3]""",,Broadcast [sound:googletts-f028afda-6c2e7c81-95402ec3-7b6ac2f6-3ef24eaa.mp3],The radio was brought to technical maturity around 100 years ago.,Der Rundfunk wurde vor rund 100 Jahren zu technischer Reife gebracht.,
A1-NOUN-665,A1,,"""<span class=""""der"""">der</span> Saft [sound:googletts-e9dbcd07-f79c21ec-8fb78983-89e1e505-d87b6db0.mp3]""",,Juice [sound:googletts-b0cfcae3-238b1624-ef20c354-7d0339e0-4a516a1d.mp3],I am squeezing an orange to get fresh juice.,"Ich drücke eine Orange aus, um frischen Saft zu erhalten.",
A1-NOUN-666,A1,,"""<span class=""""der"""">der</span> Salat [sound:googletts-41e7365b-4d14f89a-d7ce725d-efec0cdb-03e6768f.mp3]""",,Lettuce [sound:googletts-e05ec594-8d4ec10d-c51a78e7-d3e1fc19-6ef38c5b.mp3],I need to put the olives for the salad.,Ich habe dein Sandwich mit zwei Blättern Salat belegt.,
A1-NOUN-667,A1,,"""<span class=""""der"""">der</span> Salon [sound:googletts-183a81d6-7fe9a492-0d32daa6-5a5ba8f4-8b4ce1b3.mp3]""",,Beauty Parlor [sound:googletts-503ebe63-847377a4-59d07980-d78159e5-22871160.mp3],She had her hair done only in the most expensive salons.,Sie ließ sich nur in den teuersten Salons frisuren.,
A1-NOUN-668,A1,,"""<span class=""""der"""">der</span> Samstag [sound:googletts-9937a7d6-c6ce9216-f298d1be-397096d6-1184cf52.mp3]""",,Saturday [sound:googletts-1e51ebc4-e161c1d1-3a84d5b2-783787f4-e8a34e45.mp3],Saturday is the day between Friday and Sunday.,Samstag ist der Tag zwischen Freitag und Sonntag.,
A1-NOUN-669,A1,,"""<span class=""""der"""">der</span> Sand [sound:googletts-0243d8ef-c48ce995-54972ac5-ad9f6b67-8595812c.mp3]""",,Sand [sound:googletts-94e43ffe-1be7d5cc-a82dc783-84e0a7fb-1bfecf14.mp3],There is no shortage of sand in the desert.,There is no shortage of sand in the desert.,
A1-NOUN-670,A1,,"""<span class=""""der"""">der</span> Sänger [sound:googletts-32862b81-43482777-ddcc5cc6-6d9fb104-6aa29a92.mp3]""",,Singer {male} [sound:googletts-73a66103-d287c6d0-58bd4dcd-0053d324-11eb6ef7.mp3],The singer has released a new album.,Der Sänger hat ein neues Album herausgegeben.,
A1-NOUN-671,A1,,"""<span class=""""der"""">der</span> Satz [sound:googletts-272d7f29-b28e66fe-24c819b8-72e54238-12736726.mp3]""",,Sentence [sound:googletts-2d3132ad-7b0d68aa-b23ebd22-5f3deaa4-4bb90f80.mp3],The teacher wrote a few sentences on the board.,Der Lehrer schrieb einige Sätze an die Tafel.,
A1-NOUN-672,A1,,"""<span class=""""der"""">der</span> Schaden [sound:googletts-0420a501-0814794a-501a1cdd-e29c3636-3c444f53.mp3]""",,Harm [sound:googletts-e90f50e3-d8a6cc24-bc262b64-c0701bdf-6e9a4aa7.mp3],My insurance will pay for the damage.,Meine Versicherung wird für den Schaden aufkommen.,
A1-NOUN-673,A1,,"""<span class=""""der"""">der</span> Schal [sound:googletts-7da0c10c-22306e6a-c1ead97b-ca7050b1-97ef52c0.mp3]""",,Shawl [sound:googletts-13641b8a-9e35388a-99827f33-24884ed1-fdd1ff01.mp3],The woman wore a red silk scarf around her neck.,Die Frau trug ein rotes Seidentuch um den Hals.,
A1-NOUN-674,A1,,"""<span class=""""der"""">der</span> Schalter [sound:googletts-e99e637c-47768644-2f1c0009-d766b30f-e447bebb.mp3]""",,Counter [sound:googletts-7c13d825-a8739326-3109bf77-bcd1f370-96dc22fd.mp3],A relay is an electrical switch.,Ein Relais ist ein elektrischer Schalter.,
A1-NOUN-675,A1,,"""<span class=""""der"""">der</span> Schatten [sound:googletts-b052a8b9-bebb7b6f-23f9d5b0-7a7cf38c-8c0d62e1.mp3]""",,Shadow [sound:googletts-183d8bb2-a2cd32ef-4b5def25-c18fe171-30778ec4.mp3],The interplay of light and shadow was fascinating.,Das Zusammenspiel von Licht und Schatten war faszinierend.,
A1-NOUN-676,A1,,"""<span class=""""der"""">der</span> Schaukelstuhl [sound:googletts-c6a2bd5f-50a8d885-672d9953-da1e1ffe-f1ef1129.mp3]""",,Rocking Chair [sound:googletts-b0e48b65-2266c68c-c9a5f6db-894d8660-c9363047.mp3],I sat down in the rocking chair and started reading a book.,"Ich setzte mich in den Schaukelstuhl und begann, ein Buch zu lesen.",
A1-NOUN-677,A1,,"""<span class=""""der"""">der</span> Schauspieler [sound:googletts-385d5024-42f8d5b8-a94e1450-758371cf-3a9b8ae3.mp3]""",,Actor {male} [sound:googletts-2edc7e5f-eb4d025f-7e2954db-6a74f056-95c5c392.mp3],Many hopeful actors came to the casting.,Viele hoffnungsvolle Schauspieler kamen zum Casting.,
A1-NOUN-678,A1,,"""<span class=""""der"""">der</span> Schimpfen [sound:googletts-071dd0a0-21e8108c-b0d3642e-96bf4026-d85b8c03.mp3]""",,Scolding [sound:googletts-6dba29e3-5e38eeee-a9527a99-9dd75c4b-fca2dea6.mp3],They railed against the motorist who tried to overtake them.,"Sie schimpfte auf die Autofahrer, die versuchten, sie zu überholen.",
A1-NOUN-679,A1,,"""<span class=""""der"""">der</span> Schinken [sound:googletts-4e97c0d8-6b034b43-844294d0-3efd4546-b86bf983.mp3]""",,Ham [sound:googletts-ee148860-26ba285a-7c09b8cb-edb0e39b-c95576dd.mp3],He tried to lure the dog with a piece of ham.,"Er versuchte, den Hund mit einem Stück Schinken zu ködern.",
A1-NOUN-680,A1,,"""<span class=""""der"""">der</span> Schlaf [sound:googletts-ed427712-61c1e151-59bd82cf-ad4133db-69d03c4d.mp3]""",,Sleep [sound:googletts-9707e637-4be6d9e2-4a17900c-2ae97114-ee782c40.mp3],The baby was asleep in his cradle.,Das Baby schlief in seiner Wiege.,
A1-NOUN-681,A1,,"""<span class=""""der"""">der</span> Schluss [sound:googletts-b3600828-2e04f5e9-820188a1-ed212036-1e088d77.mp3]""",,Conclusion [sound:googletts-63e7173d-5c0ebc76-25706188-5b9fb63b-e699d46d.mp3],There is an unexpected twist at the end of the crime novel.,Am Schluss des Krimis gibt es eine unerwartete Wendung.,
A1-NOUN-682,A1,,"""<span class=""""der"""">der</span> Schlüssel [sound:googletts-86edff59-1db73e77-52c58c0d-76575980-a134216d.mp3]""",,Key [sound:googletts-9b806e91-1a6eea30-75b49e01-adbdabce-5492b635.mp3],Damn it! I lost my keys!,Verdammt! Ich habe meine Schlüssel verloren!,
A1-NOUN-683,A1,,"""<span class=""""der"""">der</span> Schmerz [sound:googletts-0f09c1fe-a9ee565f-fad41e48-bca0af52-26938848.mp3]""",,Pain [sound:googletts-a4f81742-ea8b5f76-1f0a67cb-8fa137f5-2a852c04.mp3],I left pain and sorrow behind and felt happy again.,Ich ließ Schmerz und Leiden hinter mir und fühlte mich wieder glücklich.,
A1-NOUN-684,A1,,"""<span class=""""der"""">der</span> Schmetterling [sound:googletts-5fac0be7-0f89f349-f5b0f911-3767131f-682c9757.mp3]""",,Butterfly [sound:googletts-9b0e43e3-1995bff7-0d9f04c4-18f897a1-216e5304.mp3],My cat likes to hunt butterflies in the garden.,Meine Katze jagt gerne Schmetterlinge im Garten.,
A1-NOUN-685,A1,,"""<span class=""""der"""">der</span> Schmuck [sound:googletts-70b9b9ec-2987012e-654e2ab7-ccdf2830-a6725c63.mp3]""",,Jewellery [sound:googletts-00e8bd51-0d5c0340-5cb5d342-608fe70b-43e59e66.mp3],She likes to wear earrings and other jewellery.,Sie trägt gern Ohrringe und anderen Schmuck.,
A1-NOUN-686,A1,,"""<span class=""""der"""">der</span> Schnee [sound:googletts-9824a9ac-953ffb96-21d21127-6758dd07-25571450.mp3]""",,Snow [sound:googletts-cd31b733-1ba0cb8b-e05e1208-8e38453b-606c52d3.mp3],You rarely see snow in Australia.,Sie sehen selten Schnee in Australien.,
A1-NOUN-687,A1,,"""<span class=""""der"""">der</span> Schnupfen [sound:googletts-a77a5be8-8aece476-bd3a1b9c-3bc9e2c7-e0a590b1.mp3]""",,Cold [sound:googletts-664f06e6-a8bd1323-f975be40-7d1b489e-5eb2214d.mp3],At the moment it is cold and there is snow.,Im Moment ist es kalt und es liegt Schnee.,
A1-NOUN-688,A1,,"""<span class=""""der"""">der</span> Schrank [sound:googletts-5e0758d6-565eca1e-f1699361-276b984d-6edff33e.mp3]""",,Cupboard [sound:googletts-1792a89a-c5aa9f29-2293921f-bc0d25fb-096056e5.mp3],He put the clean plates back in the cupboard.,Er stellte die sauberen Teller in den Schrank zurück.,
A1-NOUN-689,A1,,"""<span class=""""der"""">der</span> Schreibblock [sound:googletts-f4343c71-77abbe58-b8897be1-63e32096-7c71c897.mp3]""",,Notepad [sound:googletts-51d1eaec-2d83078c-75367be5-d65ad752-03a0791a.mp3],A notepad is a small computer.,Ich notierte die Informationen auf meinem Schreibblock.,
A1-NOUN-690,A1,,"""<span class=""""der"""">der</span> Schreibtisch [sound:googletts-13396be1-a1aec72a-17048cc6-ecf7ca71-eda1481e.mp3]""",,Desk [sound:googletts-b454397e-3dc0ea92-0fcb1374-87d323c9-fd59170b.mp3],She sat down at her desk and switched on her computer.,Sie setzte sich an ihren Schreibtisch und schaltete ihren Computer ein.,
A1-NOUN-691,A1,,"""<span class=""""der"""">der</span> Schritt [sound:googletts-299d0048-b18f322d-cb76f538-6e7867b0-3c436f06.mp3]""",,Step [sound:googletts-e614a387-668ab987-1bda0507-9bfc6f96-241396d8.mp3],Loading...,Wir sind unseren Wettbewerbern immer einen Schritt voraus.,
A1-NOUN-692,A1,,"""<span class=""""der"""">der</span> Schuh [sound:googletts-ef868959-328aa355-7ca3df3b-5077cef5-efee6300.mp3]""",,Shoe [sound:googletts-b54de58c-ac961d8d-a11502e9-f1360a55-43967b14.mp3],These shoe<span class=mark>s have red soles.,Diese Schuh<span class=mark>e haben rote Sohlen.,
A1-NOUN-693,A1,,"""<span class=""""der"""">der</span> Schüler [sound:googletts-b9a816e3-1ad6f420-f914bc6a-25f76730-a85dad48.mp3]""",,Schoolboy {male} [sound:googletts-a5fd3f21-af714eed-4afdd8b4-dfd730b7-8144cfb1.mp3],All the pupils had done their homework.,Alle Schüler hatten ihre Hausaufgaben gemacht.,
A1-NOUN-694,A1,,"""<span class=""""der"""">der</span> Schutz [sound:googletts-483af3f3-30d2e342-3d68598a-13f4520b-8cf56990.mp3]""",,Protection [sound:googletts-89328186-6e4cc827-c429aea8-5e5904ae-99cf6a25.mp3],We can afford protection to people in need.,Wir können bedürftigen Menschen Schutz bieten.,
A1-NOUN-695,A1,,"""<span class=""""der"""">der</span> Schwan [sound:googletts-7440c0ea-ef1be48a-5c8db49e-5849c160-63d8d8c9.mp3]""",,Swan [sound:googletts-0623021c-ed45dc13-b6837eba-125e1929-b292637d.mp3],"The designated also as a swan, but belonging to a different genus Koskorobaschwan also lives in South America.","Der ebenfalls als Schwan bezeichnete, aber zu einer anderen Gattung gehörende Koskorobaschwan lebt ebenfalls in Südamerika.",
A1-NOUN-696,A1,,"""<span class=""""der"""">der</span> Schwiegervater [sound:googletts-27547e88-8b602b65-dc378f40-9edab594-642ea8c9.mp3]""",,Father-In-Law [sound:googletts-9466283d-4c8ec4ca-e3d1e46f-236299a4-7d9eedc3.mp3],With my father I understand me well.,Mit meinem Schwiegervater verstehe ich mich gut.,
A1-NOUN-697,A1,,"""<span class=""""der"""">der</span> See [sound:googletts-90cd990f-6ff892ce-ec8a2d5e-664afe14-325a70d6.mp3]""",,Lake [sound:googletts-2a278efb-6b1f0bb1-49037804-e792c234-cde15ac4.mp3],Ich sehe den Sonnenaufgang vom Bett aus.,Ich sehe den Sonnenaufgang vom Bett aus.,
A1-NOUN-698,A1,,"""<span class=""""der"""">der</span> Sekretär [sound:googletts-3f510a6f-5b144c45-cab500ee-f3f41169-164ead9f.mp3]""",,Secretary {male} [sound:googletts-ff4f4c24-15a5492d-54be74cd-3d9687d5-3805771d.mp3],My dad works as a secretary for a lawyer.,Mein Vater arbeitet als Sekretär für einen Anwalt.,
A1-NOUN-699,A1,,"""<span class=""""der"""">der</span> Selbstzweifel [sound:googletts-08f20d48-c2d22c45-75124f49-d62c490a-d6975937.mp3]""",,Self-Doubt [sound:googletts-a80e6261-c2a57843-6feed15c-bccb6631-e1340501.mp3],"Self-doubt and negative feelings that contribute to low self-esteem, among the negative emotions","Selbstzweifel und negative Gefühle, die zu einem geringen Selbstwertgefühl beitragen, gehören zu den negativen Emotionen",
A1-NOUN-700,A1,,"""<span class=""""der"""">der</span> Senior [sound:googletts-e7b22e14-fb69ee1f-63bb5003-1f726fb2-f363a789.mp3]""",,Senior [sound:googletts-a0f799c7-dfdfe58e-b2659c7a-da3abb47-1f2e3669.mp3],"He was at an advanced age, a senior.","Er war im fortgeschrittenen Alter, ein Senior.",
A1-NOUN-701,A1,,"""<span class=""""der"""">der</span> Sessel [sound:googletts-dd4cb737-2b0019da-cf523734-916f8b7a-baa9672f.mp3]""",,Armchair [sound:googletts-d0831ec3-b548825d-c843f229-31c46e67-a0b6f55c.mp3],"If a buyer is interested, for example, in lounge furniture and easy chairs from John Bronco.",interessiert sich ein Käufer beispielsweise für Loungemöbel und Sessel von John Bronco.,
A1-NOUN-702,A1,,"""<span class=""""der"""">der</span> Sieger [sound:googletts-f372a9b5-bc582ae7-e1dbbc2b-d68a2e40-4fdba75a.mp3]""",,Victor [sound:googletts-c2b0d378-61f758da-d05d791b-e083db31-32c92f40.mp3],The winner had a considerable lead over the other runners.,Der Sieger hatte einen beträchtlichen Vorsprung gegenüber den anderen Läufern.,
A1-NOUN-703,A1,,"""<span class=""""der"""">der</span> Snack [sound:googletts-86a285f0-ea36aff0-6cd19162-fe1a4013-442629ee.mp3]""",,Snack [sound:googletts-b9235177-36c27922-d952171e-670ff3e3-6a93dd78.mp3],Ich packe Snacks für unseren Ausflug ein.,Ich packen Snacks Für unseren Ausflug ein.,
A1-NOUN-704,A1,,"""<span class=""""der"""">der</span> Sohn [sound:googletts-8c86a530-8d581c9b-25f776ad-293eda4e-fc46afb9.mp3]""",,Son [sound:googletts-b2102c7e-47d4393c-e943a88b-4faed55b-0747cf27.mp3],I named my son after you.,Ich habe meinen Sohn nach dir benannt.,
A1-NOUN-705,A1,,"""<span class=""""der"""">der</span> Sommer [sound:googletts-1175d58e-a7779e62-d483e21d-70ccf163-5008ae5c.mp3]""",,Summer [sound:googletts-90a9d488-9defa2e3-22137386-74e10b95-17e75405.mp3],In the summer we swim in the lake.,Im Sommer baden wir im See.,
A1-NOUN-706,A1,,"""<span class=""""der"""">der</span> Song [sound:googletts-510360f8-bc98d5e3-49d8b1b0-8336bec4-02b8dfc9.mp3]""",,Song [sound:googletts-db181ae5-1ec8096f-c0f3e75d-16c3afc4-5c9510b9.mp3],I love the tune of this song.,I love the tune of this song.,
A1-NOUN-707,A1,,"""<span class=""""der"""">der</span> Sonntag [sound:googletts-55bb2349-b75d4228-5ad0ba32-947a6151-194da809.mp3]""",,Sunday [sound:googletts-3e1361a4-b6f1ddc8-59747943-7f77b964-a3db5be5.mp3],Saturday is the day between Friday and Sunday.,Samstag ist der Tag zwischen Freitag und Sonntag.,
A1-NOUN-708,A1,,"""<span class=""""der"""">der</span> Spaß [sound:googletts-29985a18-cf3ead12-d7fbcc5c-2fcb9037-25b0c830.mp3]""",,Fun [sound:googletts-563c6a39-38c057cc-00ce8795-51a6ac3a-2be9cf17.mp3],The children will have a lot of fun at the party.,Die Kinder werden auf der Party viel Spaß haben.,
A1-NOUN-709,A1,,"""<span class=""""der"""">der</span> Spaziergang [sound:googletts-658ba702-13eb8bdb-13c54ed9-30847478-35511949.mp3]""",,Evening Walk [sound:googletts-c086fd53-6ac2ddfd-5db2fdf3-985b59fd-348f8d5c.mp3],I am going to take a walk.,Ich werde einen Spaziergang machen.,
A1-NOUN-710,A1,,"""<span class=""""der"""">der</span> Speisewagen [sound:googletts-9f08527b-d0af1a89-56e3fcee-6ce6c46f-3de3c925.mp3]""",,Dinner Car (Wagon) [sound:googletts-9c04445f-8d667ee6-d27bd8e6-4401cc43-0a9b5bf1.mp3],We had breakfast in the diner of the train.,Wir hatten das Frühstück im Diner des Zuges.,
A1-NOUN-711,A1,,"""<span class=""""der"""">der</span> Spezialist [sound:googletts-4d282bbd-66e53215-eb00f355-84678a5a-292b6b29.mp3]""",,Specialist [sound:googletts-47b679ae-0072f2bc-e725b8e1-f56d9064-7317a54f.mp3],We need to take a specialists.,Wir müssen einen Spezialisten in Anspruch nehmen.,
A1-NOUN-712,A1,,"""<span class=""""der"""">der</span> Spiegel [sound:googletts-86f7a857-d70f1b1a-42822807-0d26f1f2-f491e7ee.mp3]""",,Mirror [sound:googletts-120a1d7b-5fedc593-bafebff3-53ca7710-421ebf0a.mp3],The mirrors create a deflection of light.,Der Spiegel erzeugt eine Ablenkung von Licht.,
A1-NOUN-713,A1,,"""<span class=""""der"""">der</span> Spielplatz [sound:googletts-af24a604-85c7234f-2143cace-e66e8e60-761c1e97.mp3]""",,Playground [sound:googletts-10d8b188-a18e3618-f55ed3f3-05890fee-f6bbd0f3.mp3],He always worries when his children are in the playground.,"Er macht sich immer Sorgen, wenn seine Kinder auf dem Spielplatz sind.",
A1-NOUN-714,A1,,"""<span class=""""der"""">der</span> Sport [sound:googletts-308cfd24-f07a889d-31b915b3-abde2745-7f67679e.mp3]""",,Sport [sound:googletts-c00a598a-93de69b9-4808e964-81984b10-8a58ecaf.mp3],Basketball is an exciting sport.,Basketball ist ein aufregender Sport.,
A1-NOUN-715,A1,,"""<span class=""""der"""">der</span> Sportler [sound:googletts-fefa0a6a-983be343-fbf950a8-9f61449e-741fc1c6.mp3]""",,Athlete {male} [sound:googletts-8946e166-9e27f899-b61d75c8-892e7835-cb03610e.mp3],The athletes set a new record at the Olympics.,Die Sportler haben bei den olympischen Spielen einen neuen Rekord aufgestellt.,
A1-NOUN-716,A1,,"""<span class=""""der"""">der</span> Staat [sound:googletts-f7a41122-a026324f-d0f9b963-e6ad9e13-710485d3.mp3]""",,State [sound:googletts-8cd6b4d5-716b4949-7ca911c5-359ef76f-b3641d60.mp3],Loading...,Mehrere Staaten haben das Abkommen unterzeichnet.,
A1-NOUN-717,A1,,"""<span class=""""der"""">der</span> Stadtplan [sound:googletts-4ad2a2a1-aba475d1-006a2b86-da9816e5-dc64af4b.mp3]""",,City Map [sound:googletts-a457297b-7889f0d1-db3cd8f6-ee616c6a-25d84aad.mp3],They studied the map that hung on a wall in the reception.,"„Sie studierten den Stadtplan, der an einer Wand in der Rezeption hing.“",
A1-NOUN-718,A1,,"""<span class=""""der"""">der</span> Standpunkt [sound:googletts-4ea766b0-6d81a6f0-14c57c29-9d978c5d-118e6342.mp3]""",,Attitude [sound:googletts-1e0f8a9b-bfb98055-514a439f-d8d393f1-e5bb7113.mp3],Employees with a positive attitude tend to be promoted faster.,Mitarbeiter mit einer positiven Einstellung werden in der Regel schneller befördert.,
A1-NOUN-719,A1,,"""<span class=""""der"""">der</span> Star [sound:googletts-9e2497e5-e92e2deb-02d45f91-16a437ed-a0c8a422.mp3]""",,Star (Artists) [sound:googletts-c027b694-9af3e972-4630fb17-1be71211-a0a9745b.mp3],She was a big star on television.,Sie war ein großer Star im Fernsehen.,
A1-NOUN-720,A1,,"""<span class=""""der"""">der</span> Stau [sound:googletts-a9e525ce-9900e6e5-fe593cd7-24bc8841-a25c098a.mp3]""",,Traffic [sound:googletts-7820b224-bb4de187-32223118-8ea9e4da-69e992c6.mp3],The journey took a long time due to heavy traffic.,Wegen des starken Verkehrs dauerte die Fahrt lange.,
A1-NOUN-721,A1,,"""<span class=""""der"""">der</span> Stecker [sound:googletts-6d26095e-ef070460-447d56f1-6ea85acc-02ca513c.mp3]""",,Plug (Electrical) [sound:googletts-af04306d-4bb86732-c4742c6e-18d35ec5-8ed4bdb9.mp3],"If the plug does not fit into the outlet, an adapter is required.","Falls der Stecker nicht in die Steckdose passt, ist ein Adapter erforderlich.",
A1-NOUN-722,A1,,"""<span class=""""der"""">der</span> Stein [sound:googletts-41009f1c-ed5c7bf3-7a79155b-e3f55263-def98228.mp3]""",,Rock [sound:googletts-ba069cfa-4eac9891-84c75794-a5c565e1-1520ef33.mp3],"With seemingly no effort, he lifted the heavy stone.",Mit scheinbar ohne Anstrengung hob er den schweren Stein.,
A1-NOUN-723,A1,,"""<span class=""""der"""">der</span> Stern [sound:googletts-d6857a63-4a0f8b3b-af23f48e-28bf0a78-918007c3.mp3]""",,Star [sound:googletts-df57286b-2bacbc22-a475cb3b-f6005ae1-37052878.mp3],She was a big star on television.,Sie war ein großer Star im Fernsehen.,
A1-NOUN-724,A1,,"""<span class=""""der"""">der</span> Stiefel [sound:googletts-a221bea7-5cdb8a7e-f353f06d-90599fc0-560db359.mp3]""",,Boot [sound:googletts-08e44afc-fae81033-850a001e-f94b303b-5834692a.mp3],His new boots are suede.,Seine neuen Stiefel sind aus Wildleder.,
A1-NOUN-725,A1,,"""<span class=""""der"""">der</span> Stier [sound:googletts-82e2503c-d586b030-d27232d1-7fd7a4c1-5f5d9b2a.mp3]""",,Bull [sound:googletts-335cafa1-dc387a25-87c1cad0-ddfe9d16-90bd1341.mp3],A bull is male; a cow is female.,Ein Stier ist männlich; eine Kuh ist weiblich.,
A1-NOUN-726,A1,,"""<span class=""""der"""">der</span> Stock [sound:googletts-2a517526-46c3118e-1d281cf3-8afb76e8-36f31b87.mp3]""",,the Storey [sound:googletts-65467b4a-a9ed20e7-19f45e13-0d657776-25aabf25.mp3],Our apartment is on the first floor.,Unsere Wohnung liegt im ersten Stock.,
A1-NOUN-727,A1,,"""<span class=""""der"""">der</span> Stoff [sound:googletts-a22cd76e-ca15f41a-bf357e37-c2714b90-09280d47.mp3]""",,Cloth [sound:googletts-f3426823-7e2228df-71207342-d2d8afc6-e3ffb126.mp3],You can clean the surface with a cloth.,Man kann die Oberfläche mit einem Tuch reinigen.,
A1-NOUN-728,A1,,"""<span class=""""der"""">der</span> Strafe [sound:googletts-9c59025f-cab58438-59e9f5b7-adf74bb7-bdbe753f.mp3]""",,Fine [sound:googletts-fc49035e-2ad6d3e7-6789700a-8b136d30-ec751b5b.mp3],We went to a very fine restaurant.,Schulen erwarten von ihren Schülern ein angemessenes Verhalten.,
A1-NOUN-729,A1,,"""<span class=""""der"""">der</span> Strand [sound:googletts-6b83adc7-78201f0a-fc254f2a-4eb3f957-d3904e70.mp3]""",,Beach [sound:googletts-364636d4-972a91a7-3e17f72f-85601e79-de58cd68.mp3],Dieses Seil besteht aus vier Strängen.,Dieser Bus bringt dich zum Strand.,
A1-NOUN-730,A1,,"""<span class=""""der"""">der</span> Streik [sound:googletts-683a16de-7c87f90f-7e5854af-6f7987b4-76015252.mp3]""",,Strike [sound:googletts-4a9b6216-245516f8-d89eb9aa-b6d47b22-a28d06ab.mp3],The union called for a strike against the measures.,Die Gewerkschaft rief zu einem Streik gegen die Maßnahmen auf.,
A1-NOUN-731,A1,,"""<span class=""""der"""">der</span> Streit [sound:googletts-25fb605e-f52ce123-11366583-68045df1-0f4c5695.mp3]""",,Quarrel [sound:googletts-89b98e9b-de6b2788-f1f4ba6e-8bd11698-cf961ff7.mp3],The lawyers worked towards a settlement of the dispute.,Die Anwälte arbeiteten auf eine Beilegung des Streites hin.,
A1-NOUN-732,A1,,"""<span class=""""der"""">der</span> Stress [sound:googletts-34dc8fa1-2294a31d-c596dd97-752df3a3-f44a45c9.mp3]""",,Stress [sound:googletts-a239c336-878d40e8-4abc658e-52ccdc5e-8f0ae87c.mp3],This oil protects the material against stress.,Dieses Öl schützt das Material vor Beanspruchung.,
A1-NOUN-733,A1,,"""<span class=""""der"""">der</span> Student [sound:googletts-bfabba05-8cd3db7a-bc116bd9-f3d7c13f-ff211796.mp3]""",,Student {male} [sound:googletts-4fb9223f-f0985546-a40ac377-c7d7ae35-2971c975.mp3],The policies apply to all students.,Die Richtlinien gelten für alle Studenten.,
A1-NOUN-734,A1,,"""<span class=""""der"""">der</span> Stuhl [sound:googletts-e77af283-8df3b3fe-0ea80aff-3fe1c5b1-82f732ae.mp3]""",,Chair [sound:googletts-743fe220-a5859d6b-1c540f98-f97acfd7-606a50d4.mp3],The man sat down on the chair.,Der Mann setzte sich auf den Stuhl.,
A1-NOUN-735,A1,,"""<span class=""""der"""">der</span> Sturm [sound:googletts-b6d15dad-eeab4ca6-64d4b964-c1af8aa8-a8cd664b.mp3]""",,Storm [sound:googletts-54737e9f-8c85089d-061871a4-663dcee2-237d4e82.mp3],The storm blew all the leaves off the tree.,The storm blew all the leaves off the tree.,
A1-NOUN-736,A1,,"""<span class=""""der"""">der</span> Süden [sound:googletts-5c3dfda4-93895073-86521050-42ef6cb8-88f6685d.mp3]""",,South [sound:googletts-a09fc2a6-87347db7-107c9198-99c87267-493b43e6.mp3],I live in the north but I'm originally from the south.,"Ich wohne im Norden, komme aber ursprünglich aus dem Süden.",
A1-NOUN-737,A1,,"""<span class=""""der"""">der</span> Supermarkt [sound:googletts-28c8c28a-0bf46eaf-295a8eb8-d21608c8-d8b99e0b.mp3]""",,Supermarket [sound:googletts-a209c486-09e32586-a86eae9d-9b49e78f-ed487273.mp3],The supermarket buys its goods from wholesale.,Der Supermarkt kauft seine Waren im Großhandel.,
A1-NOUN-738,A1,,"""<span class=""""der"""">der</span> Tag [sound:googletts-b26450d4-8a1d86c3-ac37bd58-9576a4f7-f33d0964.mp3]""",,Day [sound:googletts-88145c37-a65956c1-5bffae03-73921354-738c63b8.mp3],A day consists of 24 hours.,Ein Tag besteht aus 24 Stunden.,
A1-NOUN-739,A1,,"""<span class=""""der"""">der</span> Tanz [sound:googletts-414d548b-49356d23-36dbdba9-aa99be75-a923b11c.mp3]""",,Dance [sound:googletts-3bd6ed5a-b902a5c1-6675892c-34eb064a-ad1e838c.mp3],"The ladies picked their partners, and the dance began.","Die Damen wählten ihre Partner aus, und der Tanz begann.",
A1-NOUN-740,A1,,"""<span class=""""der"""">der</span> Tarif [sound:googletts-fb6d64bc-89a484b3-6c13a736-680d64f9-db72eb37.mp3]""",,Tariff [sound:googletts-ae2457b3-2918a512-f87c31d9-ed4c25f3-c393ef6c.mp3],The tariff on exports was reduced.,Der Zoll auf Exporte wurde reduziert.,
A1-NOUN-741,A1,,"""<span class=""""der"""">der</span> Taxifahrer [sound:googletts-f3aaf454-35d1d522-a7eb5376-f7b0456e-981dbb1b.mp3]""",,Taxi Driver {male} [sound:googletts-6001410b-937b097a-41bb80a7-0e0129b3-59fa228a.mp3],"I have a bad sense of direction, so I would be a very unsuitable taxi driver.","Ich habe einen schlechten Orientierungssinn, also wäre ich ein sehr ungeeigneter Taxifahrer.",
A1-NOUN-742,A1,,"""<span class=""""der"""">der</span> Techniker [sound:googletts-d58b2912-14347a2e-7eb5b5ee-31119ff3-05f2619b.mp3]""",,Technician {male} [sound:googletts-0808061f-f2cdd4bc-0e28f055-abe59631-da2b83f9.mp3],The technician tinned the wire before soldering it.,"Der Techniker verzinnte den Draht, bevor er ihn lötete.",
