A1-NOUN-335,A1,,"""<span class=""""der"""">der</span> Azubi [sound:googletts-1972bd96-603c7462-63428053-5576a11a-2f531945.mp3]""",,Trainees [sound:googletts-8e636eca-8d3a69a8-d18b2f80-bc3ab6b9-75d7cb85.mp3],Trainees want to learn what a company does.,"Praktikanten möchten lernen, was in einer Firma gemacht wird.",
A1-NOUN-336,A1,,"""<span class=""""der"""">der</span> Babysitter [sound:googletts-80e7230c-763a52b2-a75d8b1c-78f68392-86be9a0c.mp3]""",,Babysitter [sound:googletts-b197e669-b60c84ff-0059ab2d-265113a0-f5ccc702.mp3],"I always call the same babysitter, she is very reliable.","I always call the same babysitter, she is very reliable.",
A1-NOUN-337,A1,,"""<span class=""""der"""">der</span> Bäcker [sound:googletts-918427e1-010b994d-176c3a79-ed75bca8-c01d8db8.mp3]""",,Baker [sound:googletts-0204707f-a99a0d1c-f48cd3b5-ff1c168a-f6a0aa5d.mp3],The baker poured some flour into a bowl.,Der Bäcker schüttete etwas Mehl in eine Schüssel.,
A1-NOUN-338,A1,,"""<span class=""""der"""">der</span> Bahnhof [sound:googletts-d217fea7-c62a55f2-208ec448-93598ec2-6ffe91b5.mp3]""",,Train Station [sound:googletts-fd57d79c-e9627322-a1783422-c918bd8e-db55cf82.mp3],I have to get off the train at the next station.,Am nächsten Bahnhof muss ich aus dem Zug aussteigen.,
A1-NOUN-339,A1,,"""<span class=""""der"""">der</span> Bahnsteig [sound:googletts-4c188196-45ba7fd1-f3a4d7bb-9e19cf63-c05527b8.mp3]""",,Platform [sound:googletts-a19e42bd-c35bea41-5d2f0ae7-e1dc7e1a-d5275a4c.mp3],Social networks can serve as a platform for business.,Mein Zug wird in Kürze vom Bahnsteig abfahren.,
A1-NOUN-340,A1,,"""<span class=""""der"""">der</span> Balkon [sound:googletts-27841bbb-a6a5e886-ad84c7b9-9e8a2a4a-08a4e66b.mp3]""",,Balcony [sound:googletts-8380e065-3538bb78-965d6201-a3715ca2-3b433800.mp3],Our balcony is facing the street.,Unser Balkon ist der Straße zugewandt.,
A1-NOUN-341,A1,,"""<span class=""""der"""">der</span> Bär [sound:googletts-7c0b93f2-89e81eec-4672b547-cdac889e-a968e281.mp3]""",,Bear [sound:googletts-3145c153-40f5de84-ed392a62-474aed76-2d8474dc.mp3],Investors bear all the risk themselves.,Anleger tragen das gesamte Risiko alleine.,
A1-NOUN-342,A1,,"""<span class=""""der"""">der</span> Bart [sound:googletts-e2016c0b-7bef785f-d93fbb8a-8ecc710a-381553bd.mp3]""",,Beard [sound:googletts-34d84554-89c1777c-bc75fdc9-05ca193a-a2546197.mp3],He decided to shave off his beard.,"Er beschloss, seinen Bart abrasieren.",
A1-NOUN-343,A1,,"""<span class=""""der"""">der</span> Basketball [sound:googletts-53b9cf93-d43714b8-42924b71-11bcdcc3-dd9ad3a6.mp3]""",,Basketball [sound:googletts-abcdb736-ff4147fc-9e863489-a4fec977-674bedfe.mp3],My father plays handball and basketball.,My father plays handball and basketball.,
A1-NOUN-344,A1,,"""<span class=""""der"""">der</span> Bau [sound:googletts-0dddfb6c-924e9dd8-8140631a-3dcf1377-f7c695c9.mp3]""",,Construction [sound:googletts-e56e8b62-6731203b-642a8f21-ba61d063-2dc2577f.mp3],The construction of the building is almost completed.,Der Bau des Gebäudes ist fast abgeschlossen.,
A1-NOUN-345,A1,,"""<span class=""""der"""">der</span> Bauch [sound:googletts-ff5c67ff-67f2ca4b-8cf7591e-bef6f753-1905683e.mp3]""",,Belly [sound:googletts-06f042ec-0e7de292-4a4865bf-aec98d4d-8e050ff3.mp3],We digest and absorb nutrients in the gut.,Wir verdauen und nehmen Nährstoffe im Bauch auf.,
A1-NOUN-346,A1,,"""<span class=""""der"""">der</span> Bauer [sound:googletts-d9c05afb-df5d3c09-013a426d-e8970335-e156e9d3.mp3]""",,Farmer [sound:googletts-a613c0f4-50002606-228598df-f53d7738-d61022af.mp3],The farmer grows wheat.,Der Landwirt baut Weizen an.,
A1-NOUN-347,A1,,"""<span class=""""der"""">der</span> Bauernhof [sound:googletts-7d55b492-b1fbc4d2-0f54bf60-5e0d5e42-41bce548.mp3]""",,Farm [sound:googletts-fee34cae-cc8c37cf-1774905f-8402da9b-05c9bd15.mp3],A farm often has cows and chickens.,Auf einem Bauernhof gibt es oft Kühe und Hühner.,
A1-NOUN-348,A1,,"""<span class=""""der"""">der</span> Baum [sound:googletts-9e799878-145906fd-00193d34-363d4b4b-f8e3f252.mp3]""",,Tree [sound:googletts-707ec3c7-eac802e2-2589372f-cfc434d6-346e6ffa.mp3],The children danced around the tree.,Die Kinder tanzten um den Baum.,
A1-NOUN-349,A1,,"""<span class=""""der"""">der</span> Beamte [sound:googletts-c0146800-36beb652-c2fe3ebf-816131a0-c606f3c8.mp3]""",,Officer {male} [sound:googletts-a713ae2e-7344f95f-bbc83b89-754aa208-061d6503.mp3],High-level officials will visit the embassy next week.,Hochrangige Beamte werden nächste Woche die Botschaft besuchen.,
A1-NOUN-350,A1,,"""<span class=""""der"""">der</span> Beistelltisch [sound:googletts-ff9f2ea6-19c75c0c-7e9b5a2a-82b29064-ba2c15a1.mp3]""",,End Table [sound:googletts-d6395cb0-e7799988-c0d0f1c1-8c2afad7-46be4ee3.mp3],The dishes that did not fit on the table were on the side table.,"Die Speisen, die auf dem Tisch keinen Platz hatten, standen auf dem Beistelltisch.",
A1-NOUN-351,A1,,"""<span class=""""der"""">der</span> Beitrag [sound:googletts-8549a968-02017588-cf00ec03-dc268160-86a7ff2d.mp3]""",,Article [sound:googletts-8fccbea4-9b823fc5-56c01110-d3ef5619-26b9721d.mp3],The team thanked the donors for their contribution.,Das Team bedankte sich bei den Spendern für ihren Beitrag.,
A1-NOUN-352,A1,,"""<span class=""""der"""">der</span> Bekannte [sound:googletts-2f0f2c0c-821f14ee-6ee8a09b-5b836855-f19f70b2.mp3]""",,Acquaintance {male} [sound:googletts-0ef3d0f0-43834500-bc2def93-fe353c6b-ca6bda50.mp3],"She is a friend of mine, but we are not in close contact.","Sie ist eine Bekannte von mir, aber wir stehen in keinem engen Kontakt.",
A1-NOUN-353,A1,,"""<span class=""""der"""">der</span> Beleg [sound:googletts-b8371e17-f91c40b7-e5e80689-93efbc46-9ddda21f.mp3]""",,Evidence [sound:googletts-030f2a27-445412e3-47387fb9-51ccc856-af70ee39.mp3],A receipt is not necessary to prove purchase.,"Ein Beleg ist nicht erforderlich, um den Kauf nachzuweisen.",
A1-NOUN-354,A1,,"""<span class=""""der"""">der</span> Bereich [sound:googletts-d2871e0d-4ed3bdae-6f6e782a-86162822-92606d48.mp3]""",,Realm [sound:googletts-854f7bea-ca9f77a3-b347e033-06ed5ed7-cac98a50.mp3],We allow unrestricted access to all areas.,Wir erlauben uneingeschränkten Zugang zu allen Bereichen.,
A1-NOUN-355,A1,,"""<span class=""""der"""">der</span> Berg [sound:googletts-4f92637c-3ddb2b00-9d7c557d-237c79ea-501fe8c6.mp3]""",,Mountain [sound:googletts-7ba95b8e-beafdc79-d2ace821-a3892dae-e5aef445.mp3],The summit is the top of a mountain.,Der Gipfel ist die Spitze eines Berges.,
A1-NOUN-356,A1,,"""<span class=""""der"""">der</span> Bericht [sound:googletts-0fa6bd5f-bb115cc3-41f0db97-50bd17f6-2fa7ca37.mp3]""",,Report [sound:googletts-5b0f74c0-5ad9e471-add5e750-f1f64c00-702a0244.mp3],The expert wrote a report.,Der Gutachter schrieb einen Bericht.,
A1-NOUN-357,A1,,"""<span class=""""der"""">der</span> Beruf [sound:googletts-a069e9b8-5fe8fb65-bf278ad6-b2cf4ed4-01531aa4.mp3]""",,Profession [sound:googletts-8abb52fe-798356b8-899b7666-1f165f7f-ce86914f.mp3],Many professions require a university degree.,Viele Berufe erfordern einen Hochschulabschluss.,
A1-NOUN-358,A1,,"""<span class=""""der"""">der</span> Besuch [sound:googletts-9d2a0672-0af6bfdc-0f2cae0e-92baa8e0-eb21cb48.mp3]""",,Visit [sound:googletts-7a415ab9-805919d5-c1d3829a-6e860e98-7aabae02.mp3],Our first visit to the city was very exciting.,Unser erster Besuch in der Stadt war sehr aufregend.,
A1-NOUN-359,A1,,"""<span class=""""der"""">der</span> Betrag [sound:googletts-e9715129-1f320f1f-6d9e358b-bf3281d6-ebe6fe6c.mp3]""",,Amount [sound:googletts-eb3ff4b6-bede61f6-f6fd7fc7-a209877b-75ff0a9e.mp3],The amount you need to pay is in this column.,"Der Betrag, den Sie zahlen müssen, ist in dieser Spalte.",
A1-NOUN-360,A1,,"""<span class=""""der"""">der</span> Betrieb [sound:googletts-1ad55840-0c95e885-5d67554b-25b9c98e-77a47985.mp3]""",,Business [sound:googletts-b3d245d4-2297a86a-9d186e51-dcbea360-1bd5dea3.mp3],The old machines are no longer in operation.,Die alten Maschinen sind nicht mehr in Betrieb.,
A1-NOUN-361,A1,,"""<span class=""""der"""">der</span> Betriebsrat [sound:googletts-04d64fbe-ed641ec3-548123a9-50d7fbff-ffd50985.mp3]""",,Employee Organization [sound:googletts-4975f461-caac9b18-d49d93a4-3377c3f1-eb2106d9.mp3],"If they had no works council because, Marga wanted to know","Ob sie denn keinen Betriebsrat hätten, wollte Marga wissen",
A1-NOUN-362,A1,,"""<span class=""""der"""">der</span> Bewohner [sound:googletts-11f4cd71-3964a5fc-363d38bd-0ccc992c-ea1b1306.mp3]""",,Resident {male} [sound:googletts-40119fec-43b860b8-2e3ca034-abd97271-a0932086.mp3],Loud music at night may annoy other residents.,Laute Musik in der Nacht belästigt vielleicht andere Bewohner.,
A1-NOUN-363,A1,,"""<span class=""""der"""">der</span> Bikini [sound:googletts-b8242554-1f7ea31b-a5658c46-7b521416-8d5c3e3f.mp3]""",,Bikini [sound:googletts-aa439d8e-b7956557-ac276272-9d9bbf13-6e9049f7.mp3],A bikini is a two-piece swimsuit for women.,A bikini is a two-piece swimsuit for women.,
A1-NOUN-364,A1,,"""<span class=""""der"""">der</span> Bildschirm [sound:googletts-c06c4bc7-d6beb55f-225089e8-d5f70666-b4e6de26.mp3]""",,Screen [sound:googletts-268bf27a-b8944af3-4ffcd291-f99b2204-2df67240.mp3],The screen can be swiveled.,Der Bildschirm kann geschwenkt werden.,
A1-NOUN-365,A1,,"""<span class=""""der"""">der</span> Biomüll [sound:googletts-989ecdc8-0336c4d3-80beb59c-da28ccf5-95b77bd9.mp3]""",,Biowaste [sound:googletts-decba1da-2f39a53b-34ec997e-065de1d0-e9f657bd.mp3],For organic waste there is the organic waste bin in the city of Ulm.,Für Biomüll gibt es in der Stadt Ulm die Biotonne und in Ausnahmefällen die Eigenkompostierung.,
A1-NOUN-366,A1,,"""<span class=""""der"""">der</span> Bleistift [sound:googletts-37aac1c0-18444aeb-2157a357-a685abaf-12422db6.mp3]""",e,the pencil [sound:googletts-031af1e5-83eb1137-ae2904fd-8754ea9a-a2e2bcfd.mp3],Do you have a pencil?,Hast du einen Bleistift?,
A1-NOUN-367,A1,,"""<span class=""""der"""">der</span> Blick [sound:googletts-fc1123da-008414c7-041db69e-38810e59-53d6bc87.mp3]""",,Glimpse [sound:googletts-866b6734-a3c78156-34067418-0fd392fe-7e9b1403.mp3],From the hill we had a gorgeous view at the sea.,Von dem Hügel hatten wir einen großartigen Blick auf das Meer.,
A1-NOUN-368,A1,,"""<span class=""""der"""">der</span> Boden [sound:googletts-0851d9a6-cf4dbda7-f1fca5ca-3e2feaab-1843f136.mp3]""",,Floor [sound:googletts-5e42d936-8a0f3330-7cfe7acb-314bf08e-68409f8b.mp3],"Because of the fertile soil, our vegetables grow very well.","Wegen des fruchtbaren Bodens, unser Gemüse wächst sehr gut.",
A1-NOUN-369,A1,,"""<span class=""""der"""">der</span> Bogenschütze [sound:googletts-61dce879-53c364ba-ca96760d-26a8ff91-9b743fee.mp3]""",,Archer {male} [sound:googletts-32b41e36-1465b440-98f00dbb-38708c34-ea75edba.mp3],The white Archer is then removed from the game board and the Flag token is moved onto the space where the Archer had been.,"Der weiße Bogenschütze wird vom Spielplan entfernt, und die Flagge nimmt seinen Platz auf dem Spielplan ein.",
A1-NOUN-370,A1,,"""<span class=""""der"""">der</span> Braten [sound:googletts-fbc4a69a-c4d44498-9685d9c9-df9defae-c8975420.mp3]""",,Fry [sound:googletts-f3282f27-ef3fb01f-64a68d15-47192d41-2ed934c2.mp3],A roast consists of pork or beef and is cooked in the oven.,Ein Braten besteht aus Schweine- oder Rindfleisch und wird im Ofen zubereitet.,
A1-NOUN-371,A1,,"""<span class=""""der"""">der</span> Brief [sound:googletts-9003f6cb-c9b4bfd3-6cf7a743-7152cd14-7f7e6183.mp3]""",e,the letter [sound:googletts-0b57fcd2-25b98eda-8708894f-8fe916c1-3451d12e.mp3],If you have a letter for me?,Haben Sie einen Brief für mich?,
A1-NOUN-372,A1,,"""<span class=""""der"""">der</span> Briefkasten [sound:googletts-92f3b855-11a3ecc3-a7e4d2fe-d3646b46-77e2c35a.mp3]""",,Mailbox [sound:googletts-201a0435-965aabf1-819f4d48-159d12c4-077abbb1.mp3],My mailbox is full of letters.,Mein Briefkasten ist voller Briefe.,
A1-NOUN-373,A1,,"""<span class=""""der"""">der</span> Briefumschlag [sound:googletts-497c9410-d4a8f73d-d5791205-72060b4a-101e655b.mp3]""",,Envelope [sound:googletts-9690b788-a31076cc-5fb7d0d1-9d279de7-90259f85.mp3],The address is on the envelope.,"Ich habe fast vergessen, eine Briefmarke auf den Umschlag zu kleben.",
A1-NOUN-374,A1,,"""<span class=""""der"""">der</span> Bru<span class=""""der"""">der</span> [sound:googletts-ee5e77a3-b71e47e7-8468e1d6-d543eba2-1ce013f0.mp3]""",0,the brother [sound:googletts-752abd79-9c69a277-8f3c3f04-5f929423-8751b4e1.mp3],His brother works here.,Sein Bruder arbeitet auch hier.,
A1-NOUN-375,A1,,"""<span class=""""der"""">der</span> Buchstabe [sound:googletts-c0000042-ad47e72a-8bf32013-516df671-c35873d3.mp3]""",,Letter [sound:googletts-caef9e26-a0697673-6fdd2a95-0f0a01d8-6790e046.mp3],"At the end of the school year, the children had learned all letters of the alphabet.",Am Ende des Schuljahres hatten die Kinder alle Buchstaben des gelernt Alphabet.,
A1-NOUN-376,A1,,"""<span class=""""der"""">der</span> Bundeskanzler [sound:googletts-14ddb5df-39136678-02c5c206-712c9c8b-dac9a3f4.mp3]""",,Federal Chancellor {male} [sound:googletts-c31f95b6-953ce5f6-60f460a0-8d4dcd9b-3fff7bdb.mp3],The Chancellor is elected by the Bundestag.,Der Bundeskanzler wird vom Bundestag gewählt.,
A1-NOUN-377,A1,,"""<span class=""""der"""">der</span> Bürger [sound:googletts-cd572cf1-154716ea-827bd458-f7c782bb-8cacde92.mp3]""",,Citizen {male} [sound:googletts-d1d3c569-cfd99202-57ba7833-794f7767-0b9037d2.mp3],The citizens approved of the government's intervention.,Die Bürger von der Regierung Intervention genehmigt.,
A1-NOUN-378,A1,,"""<span class=""""der"""">der</span> Bürgermeister [sound:googletts-0aac5915-1c76b03e-53751778-d1956969-96abdd6f.mp3]""",,Mayor {male} [sound:googletts-0fc4a0d9-63345968-d65f3ebe-97d47d2e-49131c28.mp3],Our mayor is fond of cultural diversity.,Unser Bürgermeister liebt die kulturelle Vielfalt.,
A1-NOUN-379,A1,,"""<span class=""""der"""">der</span> Bürgersteig [sound:googletts-70b15b1c-72dc6a49-fdd60a42-3b90e0c4-9fae7963.mp3]""",,Sidewalk [sound:googletts-9ed467b6-c02db2dd-8d3a00f6-0d2c522a-6bc576cc.mp3],People stood on the pavement to watch the parade.,"Der Mann verließ den Fußweg, um die Straße zu überqueren.",
A1-NOUN-380,A1,,"""<span class=""""der"""">der</span> Bus [sound:googletts-24bfcd93-29a931ae-9c7cf40b-e0c26e6f-7645c621.mp3]""",,Bus [sound:googletts-32f815ef-7fc5d3df-65fde671-96a528a8-6ba80407.mp3],Dieser Bus bringt dich zum Strand.,Of this Bus bringt Dich zum Strand.,
A1-NOUN-381,A1,,"""<span class=""""der"""">der</span> Cent [sound:googletts-3d3dbb42-0606f6ae-cdde1fe2-ade2b794-e4cb50b5.mp3]""",,Cent [sound:googletts-d3fcb333-663706da-cf463a00-b1bd34a4-2befb79c.mp3],One hundred cents are one euro.,One hundred cents are one euro.,
A1-NOUN-382,A1,,"""<span class=""""der"""">der</span> Charakter [sound:googletts-ba102516-ec3ecf54-d03a6bc6-4111b13b-0ace8cd8.mp3]""",,Character [sound:googletts-7f25aff0-a0e4ad1b-271803f7-f19b971f-464aa653.mp3],"Due to his strong character, some find him stubborn.",Wegen seines starken Charakters finden ihn manche stur.,
A1-NOUN-383,A1,,"""<span class=""""der"""">der</span> Chat [sound:googletts-7924b2bb-af4fc36b-5e57bcd0-35515750-ddeba29d.mp3]""",,Chat [sound:googletts-ea726895-bcfbf408-06b00bea-03ad9be5-f0aa02f2.mp3],I have never participated in an online chat.,Ich habe noch nie an einem Chat im Internet teilgenommen.,
A1-NOUN-384,A1,,"""<span class=""""der"""">der</span> Chef [sound:googletts-a1396f82-d8adc0a1-7954c38d-958e7e59-8e511c13.mp3]""",,Boss {male} [sound:googletts-130bd60b-6a012253-3297118b-ea9593bb-6b2796db.mp3],The head of the company designated his successor today.,Der Chef der Firma benannte heute seinen Nachfolger.,
A1-NOUN-385,A1,,"""<span class=""""der"""">der</span> Computer [sound:googletts-d9a608dc-15ec673d-b832b65e-37b70d8b-691c54be.mp3]""",,the computer [sound:googletts-57cf1397-2ce001c8-8beeb57b-b52650e5-0a9bd2e4.mp3],When you get your new computer?,Wann bekommst du deinen neuen Computer?,
A1-NOUN-386,A1,,"""<span class=""""der"""">der</span> Cousin [sound:googletts-62369c28-96cf6617-3a842875-ccc5c51d-9d83f985.mp3]""",,Cousin [sound:googletts-b67c728f-4b7e1449-d251974b-ff36d9d4-67413291.mp3],I have two cousins. They are my uncle's daughters.,Ich habe zwei Cousinen. Sie sind die Töchter meines Onkels.,
A1-NOUN-387,A1,,"""<span class=""""der"""">der</span> Dank [sound:googletts-9a9f6c49-9aae6e2b-dc23d9f1-c5ec613b-fb2bc51a.mp3]""",,Thanks [sound:googletts-9c7573af-b7fbad85-d053233f-b5043fdc-5a4e6137.mp3],"I received your letter today, many thanks!","Ich habe Ihren Brief heute erhalten, vielen Dank!",
A1-NOUN-388,A1,,"""<span class=""""der"""">der</span> <span class=""""die"""">die</span>b [sound:googletts-30f0147b-9b4fd588-2284a2c6-ea65e969-ace55c72.mp3]""",,Thief [sound:googletts-2860680f-e8c95132-92e5e2da-3583d17d-44d042e2.mp3],The police caught the thief.,Die Polizei fasste den Dieb.,
A1-NOUN-389,A1,,"""<span class=""""der"""">der</span> Doktor [sound:googletts-d100fd24-8c755ef0-aa196be9-dad95b73-46656fc0.mp3]""",,Doctor [sound:googletts-85639404-d71e715e-5c58245a-d2b76e1a-36650e00.mp3],The doctor told me to stay at home and rest.,"Der Doktor hat gesagt, dass ich zuhause bleiben und mich ausruhen soll.",
A1-NOUN-390,A1,,"""<span class=""""der"""">der</span> Dome [sound:googletts-6fcc0847-0b25fe2c-bac5b3c0-16740a98-9ccc1b01.mp3]""",,Dome [sound:googletts-c8464609-5f60eb19-717cdde5-5c3ba56c-0c6183a6.mp3],The cathedral attracts lots of tourist every year.,Der Dom zieht jedes Jahr viele Touristen an.,
A1-NOUN-391,A1,,"""<span class=""""der"""">der</span> Dritte [sound:googletts-1d073fd6-85dd919c-130c5104-7fa9e721-74ad2d2b.mp3]""",,Third [sound:googletts-9827d4dd-5fd346d5-7d6f165c-83e072b9-5bdd471d.mp3],My name was in third place in the ranking.,Mein Name stand an dritter Stelle auf der Rangliste.,
A1-NOUN-392,A1,,"""<span class=""""der"""">der</span> Drucker [sound:googletts-ed9f86ce-c1de858a-6be2bffa-a39a43e5-b32ee2a1.mp3]""",,Printer [sound:googletts-14f4859d-c77f5c44-7483ca9b-53ec89e3-a171f2ef.mp3],The printer has a control panel with three buttons.,Der Drucker hat ein Bedienfeld mit drei Tasten.,
A1-NOUN-393,A1,,"""<span class=""""der"""">der</span> Durchschnitt [sound:googletts-de6532ab-f04b745a-0d1f322a-8dd0b8ad-e97331b6.mp3]""",,Averaged [sound:googletts-9d349c58-d1a44d89-2e8c7880-1e9ac493-201b93d1.mp3],My training sessions average 30 minutes.,Meine Trainingseinheiten betragen durchschnittlich 30 Minuten.,
A1-NOUN-394,A1,,"""<span class=""""der"""">der</span> Durst [sound:googletts-c3511019-0aeb0f14-9e1a2396-e779d399-a6646722.mp3]""",,Thirst [sound:googletts-5b1329f2-6c4964d7-027d8ea4-52a42cae-95efd24d.mp3],Water is the best beverage to quench thirst.,"Wasser ist das beste Getränk, um Durst zu löschen.",
A1-NOUN-395,A1,,"""<span class=""""der"""">der</span> Ehemann [sound:googletts-5f43bff7-91fe9be9-60b17a69-7794e370-b9bd065f.mp3]""",,Husband [sound:googletts-7143e181-35780223-cab17f36-a5dff8e8-5a3952de.mp3],I introduced my boss to my husband.,Ich stellte meinem Mann meine Chefin vor.,
A1-NOUN-396,A1,,"""<span class=""""der"""">der</span> Einbrecher [sound:googletts-d8877070-5fd9650a-d28fef08-87e240d2-3a06f2be.mp3]""",,Burglar [sound:googletts-4718fd41-de9b465a-7297061b-a71c46a1-382d8ae4.mp3],A dog in the house can have a deterrent effect on burglars.,Ein Hund im Haus kann eine abschreckende Wirkung auf Einbrecher haben.,
A1-NOUN-397,A1,,"""<span class=""""der"""">der</span> Eindruck [sound:googletts-ba4e11ad-78038779-5e0800cd-b18f1065-177afc13.mp3]""",,Impression [sound:googletts-2cf06cd1-db123cb5-5ed73123-90fd2a93-b5f98cbf.mp3],He made a very good impression at the interview.,Er machte einen sehr guten Eindruck beim Vorstellungsgespräch.,
A1-NOUN-398,A1,,"""<span class=""""der"""">der</span> Einfall [sound:googletts-7de12986-ccf69b3d-7f3963fa-df14bf79-bbafb4c5.mp3]""",,Spontaneous Idea [sound:googletts-04029f0f-6bb57572-31a14e84-ef1397b0-3db64191.mp3],The surprise party was a brilliant idea.,Die Überraschungsparty war eine brillante Idee.,
A1-NOUN-399,A1,,"""<span class=""""der"""">der</span> Einfluss [sound:googletts-464a90d3-f2a2603e-a5279051-f63d869e-32fdb531.mp3]""",,Influence [sound:googletts-bc44fd93-f6125350-23af9942-2ba03b9d-d2889412.mp3],The weather has an impact on my mood.,Das Wetter hat einen Einfluss auf meine Stimmung.,
A1-NOUN-400,A1,,"""<span class=""""der"""">der</span> Eingang [sound:googletts-9ed60d57-8ad96c2e-03af69a7-1b79f18c-ccd80f01.mp3]""",,Entrance [sound:googletts-8e2b864e-347da1f2-91fa3ef7-2f70a8cd-89c3a05a.mp3],"After receipt of payment, delivery will occur within 10 days.","Nach Eingang der Zahlung, Lieferung innerhalb von 10 Tagen erfolgen.",
A1-NOUN-401,A1,,"""<span class=""""der"""">der</span> Einkauf [sound:googletts-417722d7-dcf9ee07-bd2e4035-81d67381-fd9e4963.mp3]""",,Purchase [sound:googletts-251331d2-42590cf6-407e537e-b6f42f33-ecc279a7.mp3],He received a credit note for his next purchase.,Er kaufte Schuhe und war mit seinem Kauf zufrieden.,
A1-NOUN-402,A1,,"""<span class=""""der"""">der</span> Eintritt [sound:googletts-f44e9377-bf6a9af0-c195bbe2-125bccf6-79d4f0c9.mp3]""",,Admission [sound:googletts-dd8802ae-8bd7cf12-4a69099b-69c143a1-7a824edf.mp3],He paid the entrance fee.,Er bezahlte den Eintritt am Eingang.,
A1-NOUN-403,A1,,"""<span class=""""der"""">der</span> Einwohner [sound:googletts-ab90f9de-8087970a-31a625d2-dacf0217-5cade756.mp3]""",,Inhabitant [sound:googletts-7ba94abb-7aebd09c-400f2b76-1a71b300-d5c30c9a.mp3],This small town has few inhabitants.,Diese kleine Stadt hat nur wenige Einwohner.,
A1-NOUN-404,A1,,"""<span class=""""der"""">der</span> Elefant [sound:googletts-43a94735-be195c32-de0934a6-0fa0d12b-8e4876aa.mp3]""",,Elephant [sound:googletts-67ebafa1-6c6d8099-03ff91b8-3f7f85c6-82dd24a6.mp3],"Ants are small, elephants are big.","Ameisen sind klein, Elefanten sind groß.",
A1-NOUN-405,A1,,"""<span class=""""der"""">der</span> Ellenbogen [sound:googletts-724a06d9-c6b43104-5ea9b937-393f4e78-c8186f06.mp3]""",,Elbow [sound:googletts-b8d33c93-9dc3a7bd-a159e8cf-d6ef858d-a2d041ca.mp3],"He tried to gain space, drove his elbows out.","Er versuchte, sich Platz zu verschaffen, fuhr seine Ellenbogen aus.",
A1-NOUN-406,A1,,"""<span class=""""der"""">der</span> Elternabend [sound:googletts-08ca4fdd-a65d1239-12a2e13d-278d33e5-cd40b3ed.mp3]""",,Parent-Teacher Conference [sound:googletts-8a23a90d-e16e4194-26a05602-4d53a82d-52139243.mp3],On the first parents' meeting at the beginning of the school year in all grades four parent representatives are elected.,Auf dem ersten Elternabend zu Beginn des Schuljahres werden in allen Klassen vier Elternvertreter gewählt.,
A1-NOUN-407,A1,,"""<span class=""""der"""">der</span> Elternbeirat [sound:googletts-4aa096bc-bdeea7a8-00d96b2d-1e81d8ab-32c6b12c.mp3]""",,Parents Council [sound:googletts-ff69bf73-2ec189e2-df8aee23-3bc25c87-812326da.mp3],The Parent Council will be informed as soon as possible about changes in the day-care center.,Der Elternbeirat wird möglichst frühzeitig über Veränderungen in der Tagesstätte informiert.,
A1-NOUN-408,A1,,"""<span class=""""der"""">der</span> Empfänger [sound:googletts-5f05ff7f-29dda57c-3481bc4b-846a0fe0-00b7069e.mp3]""",,Receiver [sound:googletts-7961cadb-af8a4166-6b5aae33-0f83e60a-4c1167ce.mp3],This year is a school of recipients of our donation.,Dieses Jahr ist eine Schule der Empfänger unserer Spende.,
A1-NOUN-409,A1,,"""<span class=""""der"""">der</span> Enkel [sound:googletts-7aa097a7-01c7a0a1-19d919ad-f4c9fe23-5628e5a2.mp3]""",,Grandchild [sound:googletts-088cc820-4df392f5-bcc7e374-75ef9593-f3ec996d.mp3],Grandparents tend to spoil their grandchildren.,"Großeltern haben einen Hang, ihre Enkel zu verwöhnen.",
A1-NOUN-410,A1,,"""<span class=""""der"""">der</span> Erfolg [sound:googletts-344cb397-2711ebab-5fbe7693-420ae790-20c26425.mp3]""",,Success [sound:googletts-36f96485-c0778c23-dc7841e2-af5caafc-b0e93d0f.mp3],"His first book was a great success, everybody loved it.","Sein erstes Buch war ein großer Erfolg, alle liebten es.",
A1-NOUN-411,A1,,"""<span class=""""der"""">der</span> Ersatz [sound:googletts-23202734-e12fce06-71364478-8a40b179-6f77be0e.mp3]""",,Replacement [sound:googletts-8b09b0da-eb309de0-a0b74519-6f102316-4797c2a4.mp3],We guarantee a free replacement of defective goods.,Ich forderte Ersatz für den defekten Fernseher.,
A1-NOUN-412,A1,,"""<span class=""""der"""">der</span> Erwachsener [sound:googletts-a61e3fe8-f563e327-856d721f-fb31bd2d-41c3e081.mp3]""",,Adult {male} [sound:googletts-deb297bc-e8164973-4a7cb274-5139b886-bc2fc3d4.mp3],All the adults were talking and the children were running around in between.,"Alle Erwachsenen unterhielten sich, und die Kinder liefen zwischendurch umher.",
A1-NOUN-413,A1,,"""<span class=""""der"""">der</span> Erzieher [sound:googletts-87ce4d8b-548efb1f-40059224-84ac5e92-004ee1b6.mp3]""",,Educator {male} [sound:googletts-c1ee2e0f-3bd56a47-15bccc21-570b8ec2-c9bc35cb.mp3],Two teachers look after the holiday children every day and work out a varied program.,Zwei Erzieher betreuen die Ferienkinder jeden Tag und erarbeiten ein vielfältiges Programm.,
A1-NOUN-414,A1,,"""<span class=""""der"""">der</span> Esel [sound:googletts-cbb81332-a3ba8d18-41192ce0-f979ed30-eab6311a.mp3]""",,Donkey [sound:googletts-0c0e02dd-a380a623-fc9eace6-4aed1357-3f97ea81.mp3],The climber has his equipment from a donkey wearing.,Der Bergsteiger lässt seine Ausrüstung von einem Esel tragen.,
A1-NOUN-415,A1,,"""<span class=""""der"""">der</span> Essig [sound:googletts-0d1e8fcf-f03b5dbf-e26060ff-a59195b9-85416c8a.mp3]""",,Vinegar [sound:googletts-ebae7e98-d95fa164-bf9ab122-c643c5aa-e615ea9f.mp3],I made a salad dressing with oil and vinegar.,Ich machte eine Salatsoße mit Essig und Öl.,
A1-NOUN-416,A1,,"""<span class=""""der"""">der</span> Euro [sound:googletts-48e51e1b-43eb5db2-e947129e-51a09c81-4d5337eb.mp3]""",,Euro [sound:googletts-b6f6d9d9-d1ab088b-b8f6aed0-8cf0dc61-9cb79091.mp3],The dress costs fifteen euros.,Das Kleid kostet fünfzehn Euro.,
