A1-NOUN-1065,A1,,"""<span class=""""die"""">die</span> Höhe [sound:googletts-fe3a7da3-c7fdce52-19d9316b-b657536d-764c4fca.mp3]""",,Tall [sound:googletts-3ddc1068-9734baa5-3514ebdd-23441eb2-2dbec9f8.mp3],The tower is very tall.,Der Turm ist sehr hoch.,
A1-NOUN-1066,A1,,"""<span class=""""die"""">die</span> Hose [sound:googletts-08101a0f-a6ef6888-13c26f26-3b9ab800-b282f818.mp3]""",,Pants [sound:googletts-c81c706c-8d09b964-88ac1eca-cc3c8410-c3e4f7bb.mp3],I can check if we have those pants in stock.,"Ich kann prüfen, ob wir diese Hose auf Lager haben.",
A1-NOUN-1067,A1,,"""<span class=""""die"""">die</span> Hüfte [sound:googletts-61a5ca25-d46f4a42-a61a676c-5b89ed4d-468271de.mp3]""",,Hip [sound:googletts-11b324b7-f4e99887-e4eef485-38bd128b-0ec603d2.mp3],"First, something is hip, then the trend disappears again.",Das Modell legt die Hände auf die Hüften und posiert.,
A1-NOUN-1068,A1,,"""<span class=""""die"""">die</span> Idee [sound:googletts-936702a4-db342dd2-7c5e7134-e449000d-7962110a.mp3]""",,Idea [sound:googletts-0885e2ff-62b2b450-e1740beb-a48d3725-3ff83450.mp3],I had a brilliant idea.,Ich hatte eine geniale Idee.,
A1-NOUN-1069,A1,,"""<span class=""""die"""">die</span> Impfung [sound:googletts-a685dbd4-e610f796-ec23842f-7b76cedf-f832df3b.mp3]""",,Vaccine [sound:googletts-8b1d99d0-808522c7-d55716c3-5aa0adfb-827722b0.mp3],The vaccine contains three strains of the flu virus.,Spritzen sind noch immer notwendig für viele Impfungen.,
A1-NOUN-1070,A1,,"""<span class=""""die"""">die</span> Industrie [sound:googletts-12ca1643-6d666f1f-7a2cc9c5-c57b9962-067002b0.mp3]""",,Industry [sound:googletts-a01ed5cc-cdd70ee0-c31bf44b-c3d3678c-662720e2.mp3],Engineers usually work in the industry.,Ingenieure arbeiten üblicherweise in der Industrie.,
A1-NOUN-1071,A1,,"""<span class=""""die"""">die</span> Innenstadt [sound:googletts-72d8c0e8-d9d76433-0a8823c1-2dc12279-f030db4a.mp3]""",,"Downtown, Inner City [sound:googletts-242a5680-e0612cca-4a07db7e-9b5ef2a5-dd9ef21c.mp3]",The hotel was conveniently located right in the city centre.,Das Hotel lag praktischerweise direkt in der Innenstadt.,
A1-NOUN-1072,A1,,"""<span class=""""die"""">die</span> Insel [sound:googletts-5f5a7b8c-87cf0262-c2779477-1e85dda0-a587865a.mp3]""",,Isle [sound:googletts-ba3f73e1-c78b51b0-7a0d613b-7cd108b3-72be1d70.mp3],Cuba is the largest island in the Caribbean.,Kuba ist die größte Insel in der Karibik.,
A1-NOUN-1073,A1,,"""<span class=""""die"""">die</span> Invitation [sound:googletts-fa1d1c00-9647d90b-afb686f0-331752e5-c0a10524.mp3]""",,Invitation [sound:googletts-8bc0deed-06d4bd45-dd4c8bb4-9e0ace02-328e4737.mp3],We sent the invitations four months before the wedding.,Wir verschicken die Einladungen vier Monate vor der Hochzeit.,
A1-NOUN-1074,A1,,"""<span class=""""die"""">die</span> Jacke [sound:googletts-ae8bbb20-7d161e41-6b4478d9-275af23c-c437b01a.mp3]""",,Jacket [sound:googletts-63e1c83c-eaa17ec0-9c1a94d2-33d88743-140392aa.mp3],She wore a warm jacket on this cold winter day.,An diesem kalten Wintertag trug sie eine warme Jacke.,
A1-NOUN-1075,A1,,"""<span class=""""die"""">die</span> Jeans [sound:googletts-85a8b8d5-cffbb1ed-74939709-f7ca128f-93b666a6.mp3]""",,Jeans [sound:googletts-7838e055-59b46414-96f254ff-89520d8b-5b0f1813.mp3],I need to look for a red top to go with my new jeans.,I need to look for a red top to go with my new jeans.,
A1-NOUN-1076,A1,,"""<span class=""""die"""">die</span> Journalistin [sound:googletts-f2680bc2-d0f8bb8d-c96c1e77-73fb8d36-cd53e113.mp3]""",,Journalist {female} [sound:googletts-43436c40-fb633ff3-8d5f5825-39f898e6-468afd0c.mp3],The journalist won an award for her scoop.,Die Journalistin hat einen Preis für ihren Exklusivbericht gewonnen.,
A1-NOUN-1077,A1,,"""<span class=""""die"""">die</span> Jugend [sound:googletts-ec80b93b-b00bea50-fc114414-c3595ba1-6052ed5a.mp3]""",,Youth [sound:googletts-fde3dcc8-61257367-41e57fde-9bc39f1d-6da8496e.mp3],We need to empower our youth because they are going to shape our future.,"Wir müssen unsere Jugend stärken, denn sie wird unsere Zukunft gestalten.",
A1-NOUN-1078,A1,,"""<span class=""""die"""">die</span> Jugendherberge [sound:googletts-6c5e392a-519e0378-7a2a1a7b-db621649-48d68bf7.mp3]""",,Hostal [sound:googletts-3917821c-939e460d-c6c41267-4a594b56-6163b173.mp3],"During our trip, we spent the nights at a hostel.",Während unserer Reise haben wir die Nächte in einer Jugendherberge verbracht.,
A1-NOUN-1079,A1,,"""<span class=""""die"""">die</span> Kaffeemaschine [sound:googletts-6e31b31b-d79fd3f1-ffe90530-ec376377-fd69534f.mp3]""",,Coffee Maker [sound:googletts-117a50b6-2dba85ff-b6d2a62d-58e07f63-5c581dfa.mp3],I pressed the button to switch on the coffee maker.,"Ich habe den Knopf gedrückt, um die Kaffeemaschine einzuschalten.",
A1-NOUN-1080,A1,,"""<span class=""""die"""">die</span> Kälte [sound:googletts-53267890-0aea5ab1-1899769c-e27cac13-661faaba.mp3]""",,"Coldness, Iciness [sound:googletts-ddffc597-efd6aa35-1f2913c8-e93df9a4-9f5a0450.mp3]",The cold made me shiver.,Die Kälte brachte mich zum Zittern.,
A1-NOUN-1081,A1,,"""<span class=""""die"""">die</span> Kanne [sound:googletts-2a43ed46-cc17a7ed-7e864b0a-d0a07552-bfb82983.mp3]""",,Can [sound:googletts-c1235035-e6ef6247-a7f214af-43a8228a-7fb2c389.mp3],In this pot fit 1.8 liters.,"In diese Kanne passen 1,8 Liter.",
A1-NOUN-1082,A1,,"""<span class=""""die"""">die</span> Kantine [sound:googletts-f7cef2d2-1f8b0c11-82f04d83-c2c47749-d1409b96.mp3]""",,Cafeteria [sound:googletts-f4dd6972-4d7f19a8-555d1dae-8ada66a9-c6a31af8.mp3],We had coffee in a comfortable cafeteria.,In der Mittagspause esse ich in der Kantine.,
A1-NOUN-1083,A1,,"""<span class=""""die"""">die</span> Kappe [sound:googletts-bd5916bd-d10743a2-f5595fa0-89dd5593-4ef92df5.mp3]""",,Cap [sound:googletts-51f930dd-6d590a5c-aac76fde-863da4e3-c9537a56.mp3],The baseball player had a cap on his head.,Der Baseballspieler hatte eine Kappe auf seinem Kopf.,
A1-NOUN-1084,A1,,"""<span class=""""die"""">die</span> Karikatur [sound:googletts-28afdb10-6e7e3351-482c4958-09e057b2-d03f85f0.mp3]""",,Cartoon [sound:googletts-c51e6c31-bd4e2326-916f3c25-2d41698c-80d829c8.mp3],My children love watching cartoons.,Der Cartoonist hat witzige Karikaturen gezeichnet.,
A1-NOUN-1085,A1,,"""<span class=""""die"""">die</span> Karriere [sound:googletts-746e9df3-f7cb4102-d6430943-6d2debf7-c8677f04.mp3]""",,Carrier [sound:googletts-ebe6ac15-f0d90d39-2dc973d5-ee867c21-b01ac47b.mp3],I want to focus on my career.,Ich möchte mich auf meine Karriere konzentrieren.,
A1-NOUN-1086,A1,,"""<span class=""""die"""">die</span> Karte [sound:googletts-799ac6f1-d37875f0-131c802a-c343eb1e-49e74823.mp3]""",,Card [sound:googletts-1b49aeb0-b67cd416-d1085d87-c8b3a4d3-03609333.mp3],Introduce your card into the slot.,Führen Sie Ihre Karte in den Steckplatz ein.,
A1-NOUN-1087,A1,,"""<span class=""""die"""">die</span> Karteikarte [sound:googletts-df976d75-09557a54-3d84b250-82d152e6-bc0e8579.mp3]""",,Flashcard [sound:googletts-49bdbf1f-6c89f46f-f0f3ce2b-5e3ac783-e9e46cf1.mp3],I learn vocabulary with index cards.,Ich lerne Vokabeln mit Karteikarten.,
A1-NOUN-1088,A1,,"""<span class=""""die"""">die</span> Kartoffel [sound:googletts-8e2d95ae-9fe9e4f6-6e12b4f0-0e232497-596461af.mp3]""",,Potatoe [sound:googletts-927433f8-4422fe01-e36abb42-8759359a-1e707839.mp3],Potatoes contain a lot of potassium.,Kartoffeln enthalten viel Kalium.,
A1-NOUN-1089,A1,,"""<span class=""""die"""">die</span> Kasse [sound:googletts-96a3bc4c-322c5bf2-efd240aa-01d3c46e-1aff1f05.mp3]""",,Checkout Counter [sound:googletts-72a8e7b1-e61aed81-52ab2eee-a35965d2-5b8859e0.mp3],I lined up at the checkout to pay for my shopping.,"ich stellte mich an der Kasse an, um für meinen Einkauf zu bezahlen.",
A1-NOUN-1090,A1,,"""<span class=""""die"""">die</span> Katze [sound:googletts-157b7ceb-61016cae-fc97892d-2d5a150f-e3bbb85c.mp3]""",,Cat [sound:googletts-3c25c2db-55602f5b-c1e1ce9f-103c9d6f-b3c7e3ad.mp3],We have always had a cat as a pet.,Wir hatten immer eine Katze als Haustier.,
A1-NOUN-1091,A1,,"""<span class=""""die"""">die</span> Kauffrau [sound:googletts-250b113c-fd5dc642-5dc30ca8-43ace3b3-b7811c51.mp3]""",,Merchant {female} [sound:googletts-7133d478-a8554ceb-93e52d5c-e002fa35-59915504.mp3],In 2010 we will be offering for the first time training as a businessman / businesswoman for office communication.,Im Jahr 2010 werden wir zum ersten Mal auch eine Ausbildung zum Kaufmann/zur Kauffrau für Bürokommunikation anbieten.,
A1-NOUN-1092,A1,,"""<span class=""""die"""">die</span> Kellnerin [sound:googletts-44e2bb05-86b8734b-8ad26c66-24367dbc-2d5b9d32.mp3]""",,Waitress {female} [sound:googletts-5e3f967b-76a3ee84-6b51f30e-d9a5e2dc-28c9fae6.mp3],She earns her keep as a waitress.,Sie verdient ihren Unterhalt als Kellnerin.,
A1-NOUN-1093,A1,,"""<span class=""""die"""">die</span> Kenntnis [sound:googletts-bdaefb10-acc653e8-92ed685d-6107e493-26736cba.mp3]""",,Awareness [sound:googletts-08f2b09d-febe14b7-9b8bc60c-a280971a-1b994155.mp3],I made my decision in full knowledge of the facts.,Wir müssen das Bewusstsein für die Bedürfnisse von Kindern fördern.,
A1-NOUN-1094,A1,,"""<span class=""""die"""">die</span> Kerze [sound:googletts-2bccef94-7bbabd4d-39465d73-f5c89d07-fb27364a.mp3]""",,Candle [sound:googletts-e96dba07-9f5cbfdd-de5cf1fd-9d70247e-9c6557ef.mp3],During the blackout we resorted to candles.,Während des Stromausfalls griffen wir auf Kerzen zurück.,
A1-NOUN-1095,A1,,"""<span class=""""die"""">die</span> Kette [sound:googletts-f3efac9a-213dee90-dc5cd6c8-1843f6c6-61d718ba.mp3]""",,Chain [sound:googletts-54834c43-fc5ae194-688ed58b-f4787df0-5e8ef2bd.mp3],I need a new chain for my cycle.,Ich brauche eine neue Kette für mein Fahrrad.,
A1-NOUN-1096,A1,,"""<span class=""""die"""">die</span> Kindheit [sound:googletts-69b10e81-518e0be1-01fc6017-4ebb3143-855dffbd.mp3]""",,Childhood [sound:googletts-52832e00-6967ad73-bad44997-48e8258f-a63b1886.mp3],I have good memories of my childhood.,Ich habe gute Erinnerungen an meine Kindheit.,
A1-NOUN-1097,A1,,"""<span class=""""die"""">die</span> Kirche [sound:googletts-1864082c-efe0d0b2-f4ce006c-7426d8be-414ccf79.mp3]""",,Church [sound:googletts-2e95a818-f5eab97e-2f28985f-097bd8af-aa708aac.mp3],There is a service in the church every Sunday.,Jeden Sonntag findet in der Kirche ein Gottesdienst statt.,
A1-NOUN-1098,A1,,"""<span class=""""die"""">die</span> Kirsche [sound:googletts-353e27ab-ba6f9566-5417d606-5ee41670-30160685.mp3]""",,Cherry [sound:googletts-9587d625-525ac228-d9a4f2b2-bf450384-4f493d26.mp3],"A cherry is a round, red stone fruit.","Eine Kirsche ist eine runde, rote Steinfrucht.",
A1-NOUN-1099,A1,,"""<span class=""""die"""">die</span> Kiste [sound:googletts-98ce83ee-32a9283c-446b4b35-6ebf56bf-797e0bbc.mp3]""",,Crate [sound:googletts-2b581468-a6f8f72b-0d0c1b2d-525a0950-3dfaad33.mp3],He bought two crates of a popular beer for the party.,Ich verglich die Packliste mit dem Inhalt der Kiste.,
A1-NOUN-1100,A1,,"""<span class=""""die"""">die</span> Klasse [sound:googletts-b2003fb6-5f5f3f43-56c62c28-799316a6-a24f9801.mp3]""",,Class [sound:googletts-ea6591f5-2e10721a-a896b70b-70de3745-59960837.mp3],I never had to repeat a year at school.,Ich musste keine Klasse in der Schule wiederholen.,
A1-NOUN-1101,A1,,"""<span class=""""die"""">die</span> Kleidung [sound:googletts-6874f97e-35f5b0f7-8a9fd3ed-cc5a5ab2-1e8b2ddc.mp3]""",,the clothing [sound:googletts-34ea8150-554d3185-740d351c-b987e9f6-1677ac9a.mp3],"Where do I find clothes? - Jackets in the first, jeans","Wo finde ich Kleidung? - Jacken im ersten, Jeans im",
A1-NOUN-1102,A1,,"""<span class=""""die"""">die</span> Klimaanlage [sound:googletts-47023b86-82c225b0-f6675c87-83ae026c-099ccf3c.mp3]""",,Air Conditioning [sound:googletts-9cad3cd0-3268b784-444902bd-912b494d-0a904e9c.mp3],Every room comes with air conditioning.,Jeder Raum verfügt über eine Klimaanlage.,
A1-NOUN-1103,A1,,"""<span class=""""die"""">die</span> Klinik [sound:googletts-9e7f2daa-54ea1ee6-e4adf9fc-b3e0e299-935c4886.mp3]""",,Clinic [sound:googletts-368829b3-0a606bfb-791d3c35-bc4f8419-cd89761f.mp3],I am a doctor and I work at a small clinic.,Ich bin Ärztin und arbeite in einer kleinen Klinik.,
A1-NOUN-1104,A1,,"""<span class=""""die"""">die</span> Kneipe [sound:googletts-f666894e-fdc9acbc-2c88ef29-2b619779-4152c86e.mp3]""",,Pub [sound:googletts-a195408f-48f150f4-704fb158-2919fbd8-10153dba.mp3],The landlord barred him from entering the pub.,"Der Gastwirt verbot ihm, die Kneipe zu betreten.",
A1-NOUN-1105,A1,,"""<span class=""""die"""">die</span> Köchin [sound:googletts-dd809f84-fe297530-62276812-8e2be7e2-a5af3703.mp3]""",,Cook {female} [sound:googletts-034b92df-049cd241-ddba1200-51cbe7a6-580e7749.mp3],My aunt is an excellent cook.,Meine Tante ist eine hervorragende Köchin.,
A1-NOUN-1106,A1,,"""<span class=""""die"""">die</span> Kollegin [sound:googletts-ee021713-25f81073-d6558f9f-2c986a2c-51ae60d3.mp3]""",,Colleague {female} [sound:googletts-5173bdc2-82b32140-9e121e95-e3c5ebb4-0d4d3d4d.mp3],I asked my colleague to unlock the software.,"Ich bat meine Kollegin, die Software freizuschalten.",
A1-NOUN-1107,A1,,"""<span class=""""die"""">die</span> Kommunikation [sound:googletts-4a5a4405-ffa0a60d-1e300075-f23a10ef-372f55c5.mp3]""",,Communication [sound:googletts-30f07a1f-f5c3c857-9463dd12-7482f869-f3664f0b.mp3],Good communication is the cornerstone of a relationship.,Gute Kommunikation ist der Grundstein einer Beziehung.,
A1-NOUN-1108,A1,,"""<span class=""""die"""">die</span> Konferenz [sound:googletts-9dcf0bb0-59ab3bd3-061b4809-d00cbd42-297e2cbf.mp3]""",,Conference [sound:googletts-27597777-e50f774e-fd263683-f06aa58a-b8cd6a56.mp3],My boss gave me leave to attend the conference.,"Mein Chef gab mir die Erlaubnis, die Konferenz zu besuchen.",
A1-NOUN-1109,A1,,"""<span class=""""die"""">die</span> Konkurrenz [sound:googletts-67f0c9d8-f76b56be-98b12d8d-b7e47cf2-89d64f76.mp3]""",,Competition [sound:googletts-40e18df2-ed3e7b41-061b0204-55326b66-0d84c40c.mp3],The teacher wants to avoid competition among pupils.,Der Lehrer will Konkurrenz unter Schülern vermeiden.,
A1-NOUN-1110,A1,,"""<span class=""""die"""">die</span> Kontrolle [sound:googletts-49ab1728-5cf3646e-b0de3580-b35ae9c4-4e9064a3.mp3]""",,Scrutiny [sound:googletts-e0d57d94-61dfbc10-c7da1b64-9aadf79b-e3735527.mp3],My boss had the situation under control.,Mein Chef hatte die Situation unter Kontrolle.,
A1-NOUN-1111,A1,,"""<span class=""""die"""">die</span> Kopie [sound:googletts-7cca3cf9-f8591398-96371743-10b81c7f-04b44e3f.mp3]""",,Copies [sound:googletts-bb0388a2-f5e33666-908949cb-f52f6284-cb3c5ca4.mp3],"I did not receive the original, just a copy.",Wir brauchen drei Kopien.,
A1-NOUN-1112,A1,,"""<span class=""""die"""">die</span> Kosmetik [sound:googletts-0e1e3f96-0c53253c-b2c9dcda-a0a43545-586bd192.mp3]""",,Cosmetic [sound:googletts-512228ab-5efbf9f1-37f5b850-de7e680e-8a93af93.mp3],My insurance does not cover cosmetic damage.,Meine Versicherung deckt keine kosmetischen Schäden.,
A1-NOUN-1113,A1,,"""<span class=""""die"""">die</span> Kosten [sound:googletts-3ec7aef1-ce344dbd-01a11eb8-0f36dcbf-1f014b73.mp3]""",,Costs [sound:googletts-f8f1a5bd-c9dda310-58afd07e-38e788b8-dd3daaa2.mp3],Every company wants to save costs.,Jedes Unternehmen will Kosten sparen.,
A1-NOUN-1114,A1,,"""<span class=""""die"""">die</span> Kraft [sound:googletts-472aa40a-cb150adf-ed2df6c6-355b2d12-4273ab00.mp3]""",,Force [sound:googletts-a02cae96-0f681582-1b391519-f7d89bc2-dcc6322f.mp3],The door only moves if you push it with a lot of force.,"Die Tür bewegt sich nur, wenn man mit viel Kraft dagegen drückt.",
A1-NOUN-1115,A1,,"""<span class=""""die"""">die</span> Krankenkasse [sound:googletts-de71937a-71ef8d9a-cc193310-73946339-08a3053a.mp3]""",,Health Insurance [sound:googletts-ebe26e3f-da23e3ea-159ac93b-e71c7216-69842348.mp3],My medical insurance covers the cost of my hospital stay.,Meine Krankenversicherung deckt die Kosten für meinen Krankenhausaufenthalt.,
A1-NOUN-1116,A1,,"""<span class=""""die"""">die</span> Krankenschwester [sound:googletts-d8c946dd-a67587c3-81549b1d-1cad010c-96febd85.mp3]""",,Nurse {female} [sound:googletts-251d8fe0-43020784-4ccea868-3944494c-69340c74.mp3],The nurse came to tend to my wounds.,"Die Krankenschwester kam, um meine Wunden zu versorgen.",
A1-NOUN-1117,A1,,"""<span class=""""die"""">die</span> Krankheit [sound:googletts-36945de7-36a4b4e9-bb183c41-34fb72e6-5d8875c2.mp3]""",,Illness [sound:googletts-c4a24721-ecb9ffad-3e2a45f4-6e6a7051-ccb7d534.mp3],My illness is not contagious.,Meine Krankheit ist nicht ansteckend.,
A1-NOUN-1118,A1,,"""<span class=""""die"""">die</span> Kreditkarte [sound:googletts-049c7aa5-1b695463-545f3264-6db5e39e-001a9044.mp3]""",,Credit Card [sound:googletts-82e6c92e-d0a3d268-9cb2ed81-eab242a4-ea982394.mp3],This credit card does not allow withdrawals abroad.,Diese Kreditkarte lässt keine Abhebungen im Ausland zu.,
A1-NOUN-1119,A1,,"""<span class=""""die"""">die</span> Kreuzung [sound:googletts-fcf2d593-a487d2c0-a6aad159-1dd5f981-2e0b7a45.mp3]""",,Junction [sound:googletts-10f0e13b-43594389-419e3501-09f50a6a-cb7eba63.mp3],We need to turn left at the next intersection.,Wir müssen an der nächsten Kreuzung rechts abbiegen.,
A1-NOUN-1120,A1,,"""<span class=""""die"""">die</span> Krise [sound:googletts-027ec9e8-fd8bca76-7b93e920-770ba541-cf341369.mp3]""",,Crisis [sound:googletts-733a04db-d1d3d1fa-4aee6619-4bd08749-0bd10443.mp3],The political crisis caused turmoil in the country.,Die politische Krise verursachte Unruhen im Land.,
A1-NOUN-1121,A1,,"""<span class=""""die"""">die</span> Küche [sound:googletts-62300a14-a62bf8e4-3c4a3110-16a8a837-00547d8f.mp3]""",,Kitchen [sound:googletts-33ce9340-4a3f89f6-17b380fa-c637ca32-4581d610.mp3],The house has a separate kitchen.,Das Haus verfügt über eine separate Küche.,
A1-NOUN-1122,A1,,"""<span class=""""die"""">die</span> Kugel [sound:googletts-047184fc-c5b699aa-3c56ce30-3a712e3b-d345be30.mp3]""",,Sphere [sound:googletts-7ca03e68-8bbaa6de-0bb90f48-863f4744-d7f18951.mp3],was only a ball on the pool table.,Auf dem Billardtisch war nur noch eine Kugel.,
A1-NOUN-1123,A1,,"""<span class=""""die"""">die</span> Kuh [sound:googletts-50e07a5e-5b147dee-fd748ac3-aaf52b7f-4e75976e.mp3]""",,Cow [sound:googletts-abc7b88e-22a69612-45822132-ed4e34f3-c327ca7e.mp3],"The field was empty, apart from a single cow.","Das Feld war leer, bis auf eine einzelne Kuh.",
A1-NOUN-1124,A1,,"""<span class=""""die"""">die</span> Kultur [sound:googletts-f2f7eaf9-b8674980-b048927c-2dc52a0a-40312ac9.mp3]""",,Culture [sound:googletts-3aafa48a-a727e2b6-feb86e03-7e5965b0-594ec798.mp3],I am interested in the culture of foreign countries.,Ich interessiere mich für die Kultur fremder Länder.,
A1-NOUN-1125,A1,,"""<span class=""""die"""">die</span> Kündigung [sound:googletts-21e3b6f1-8134898b-a44c484e-3b2f255f-a5070ca6.mp3]""",,Termination Notice [sound:googletts-84a80b31-a25d343b-ec08348c-4ed9b37c-498506f8.mp3],My dismissal was a good incentive to look for a better job.,"Meine Kündigung war ein guter Anreiz, nach einem besseren Job zu suchen.",
A1-NOUN-1126,A1,,"""<span class=""""die"""">die</span> Kundin [sound:googletts-911b54b9-a7830ca0-2a30e8ec-2d69c0f4-3604aa67.mp3]""",,Customer {female} [sound:googletts-17768b06-88cf1090-4c3bc6ca-cdddb771-d824db0b.mp3],She has long been a customer with us.,Sie ist schon lange Kundin bei uns.,
A1-NOUN-1127,A1,,"""<span class=""""die"""">die</span> Kunst [sound:googletts-3a09da87-65818ee7-dce4d598-092dbcf8-d99ca35c.mp3]""",,Art [sound:googletts-0868e11f-5cd32313-9fa88c39-e3d371d3-dc0a1606.mp3],There is a museum of modern art in this city.,Es gibt ein Museum für moderne Kunst in dieser Stadt.,
A1-NOUN-1128,A1,,"""<span class=""""die"""">die</span> Künstlerin [sound:googletts-816d2c7e-15e27a50-42b27d84-c9a50224-a488c33b.mp3]""",,Artist {female} [sound:googletts-0a6c2ecc-b889256f-baf113c5-cc6bc154-6bb69e47.mp3],The artist painted the beautiful scenery.,Die Künstlerin malte die schöne Landschaft.,
A1-NOUN-1129,A1,,"""<span class=""""die"""">die</span> Kursleiterin [sound:googletts-f9666d66-5dec995e-e7db475f-0218f17b-eca7924d.mp3]""",,Instructor {female} [sound:googletts-f336011c-0cbeda81-813dcec3-3a59e7cc-5811dd43.mp3],"critical points have experienced in their career to date on the issue of price leader, as the participants, says a","Auf die Frage der Kursleiterin, wie die Teilnehmenden kritische Punkte in ihrer bisherigen beruflichen Laufbahn erlebt haben, spricht ein",
A1-NOUN-1130,A1,,"""<span class=""""die"""">die</span> Küste [sound:googletts-ad3eec7c-a73466fb-d5e0cf4d-16a8a0b5-e9f89297.mp3]""",,Coast [sound:googletts-bda093be-716113ef-4d5e851c-f254981a-5490f1cf.mp3],The beach stretches along the coast.,Der Strand erstreckt sich entlang der Küste.,
A1-NOUN-1131,A1,,"""<span class=""""die"""">die</span> Lage [sound:googletts-8b1f3ae1-877c122e-846e2368-97d699ab-72afb1e0.mp3]""",,Location [sound:googletts-231aea24-93ad7a57-60f928df-7c882051-64183604.mp3],He was able to support them financially.,"Er war in der Lage, sie finanziell zu unterstützen.",
A1-NOUN-1132,A1,,"""<span class=""""die"""">die</span> Lampe [sound:googletts-048d71f8-054fb547-17615675-c696033e-f7153067.mp3]""",,Lamp [sound:googletts-1681024a-b9eef5ec-1d98693b-5388c2b3-35458b63.mp3],The lamp flashed once and then there was darkness.,Die Lampe blitzte einmal und dann war es dunkel.,
A1-NOUN-1133,A1,,"""<span class=""""die"""">die</span> Landschaft [sound:googletts-fb5c3229-c39d0ddb-fbe98222-9c96d0a5-35fc5fa4.mp3]""",,Landscape [sound:googletts-e4cd2732-0193eb4a-eb341ae5-3bd7a7f4-c7ad7731.mp3],The painting shows a blooming landscape.,Das Gemälde zeigt eine blühende Landschaft.,
A1-NOUN-1134,A1,,"""<span class=""""die"""">die</span> Landung [sound:googletts-a34c0d40-893a5913-f4fa381a-ad7f8c0e-339475a5.mp3]""",,Landing [sound:googletts-4f89016d-8400ff15-93aa28ce-7712db7f-343626cc.mp3],The pilot performed a perfect landing.,Der Pilot führte eine perfekte Landung aus.,
A1-NOUN-1135,A1,,"""<span class=""""die"""">die</span> Landwirtschaft [sound:googletts-5e7eb1e5-f9330a25-41e5c5b2-77acd9a8-577b4f3d.mp3]""",,Agriculture [sound:googletts-89a07aba-f4cd946d-52e5959c-379504e3-a339dbdf.mp3],Agriculture accounts for ten per cent of GDP.,Die Landwirtschaft macht zehn Prozent des Bruttoinlandsprodukts aus.,
A1-NOUN-1136,A1,,"""<span class=""""die"""">die</span> Lebensmittel [sound:googletts-01374054-8cbf50f3-e27dd4e7-6d23660e-fe4899e1.mp3]""",,Groceries {Pl} [sound:googletts-f75e42e9-61c785c6-e96d34a3-aacbd78d-f2cec45a.mp3],The salt in brine preserves food.,Das Salz in Sole bewahrt Nahrung.,
A1-NOUN-1137,A1,,"""<span class=""""die"""">die</span> Leistung [sound:googletts-1f9708ab-fa4c2b23-a9822bb3-2e7bb745-b0e59497.mp3]""",,Performance [sound:googletts-6a835144-0995d3a8-3e0b04c1-70876e0b-825b4a0b.mp3],The pupil was praised for his good performance in school.,Der Schüler wurde für seine gute Leistung in der Schule gelobt.,
A1-NOUN-1138,A1,,"""<span class=""""die"""">die</span> Leiter [sound:googletts-6461d613-65a2a01b-d738ace4-5e5f15d0-a53537f3.mp3]""",,Ladder [sound:googletts-849a416e-056af15f-08a64321-668fd004-9175a9ed.mp3],I need a ladder to climb onto the roof.,"Ich brauche eine Leiter, um auf das Dach zu steigen.",
A1-NOUN-1139,A1,,"""<span class=""""die"""">die</span> Leiterin [sound:googletts-f1fe182a-78c7a099-25f46648-c17987e6-4be9be19.mp3]""",,Lead {female} [sound:googletts-5272d1c6-28fd8d97-a3283de8-03d7d66c-eb4a0e39.mp3],Since 1993 she is a professor of Artistic and aesthetic practice and head of the studio MENZEL-DACH at the Humboldt University of Berlin.,Seit 1993 ist sie Professorin für Künstlerisch-Ästhetische Praxis und Leiterin des Ateliers MENZEL-DACH an der Humboldt-Universität Berlin.,
A1-NOUN-1140,A1,,"""<span class=""""die"""">die</span> Lektion [sound:googletts-cbb7dc28-a081b702-d0b9143f-07680ab9-b309a2db.mp3]""",,Lesson [sound:googletts-f93771c3-45411397-186262ac-a7894825-f8c2d6a4.mp3],The schoolbook consists of twelve lessons.,Das Schulbuch besteht aus zwölf Lektionen.,
A1-NOUN-1141,A1,,"""<span class=""""die"""">die</span> Leute (pl.) [sound:googletts-d15a0c5e-1d20a264-36e83654-6f705d5f-b6ebe8f1.mp3]""",,people (pl.) [sound:googletts-0c5b91bb-58f7879d-3f46befa-b18917e6-8b7177e2.mp3],In the disco many people.,In der Disko sind viele Leute.,
A1-NOUN-1142,A1,,"""<span class=""""die"""">die</span> Lieferung [sound:googletts-e3cb6b01-73b391fb-736e0a87-6cd36444-d329e9c1.mp3]""",,Delivery [sound:googletts-a551656f-613d611b-09fa1059-acda3c26-3c9b2f05.mp3],The delivery arrived on time.,Die Lieferung ist rechtzeitig angekommen.,
A1-NOUN-1143,A1,,"""<span class=""""die"""">die</span> Limo [sound:googletts-e26c5179-f754b698-d218705d-531362db-2f18eaab.mp3]""",,Limonade [sound:googletts-9c22d920-8fda41fe-ec149ad0-aa8933c8-4eddb9a7.mp3],I ordered a hamburger and a soda.,Ich bestellte einen Hamburger und eine Limo.,
A1-NOUN-1144,A1,,"""<span class=""""die"""">die</span> Limonade [sound:googletts-523a0135-199fc20d-03d4bd53-f1a8b819-85575b82.mp3]""",,Lemonade [sound:googletts-3fbfde9e-3448749f-cd877fc7-b29177ef-26302f58.mp3],"The bottle was open, now the lemonade tastes flat.","Die Flasche war offen, jetzt schmeckt die Limonade schal.",
A1-NOUN-1145,A1,,"""<span class=""""die"""">die</span> Lösung [sound:googletts-75a1e297-25a3daa9-7baf3772-08483ace-cb2d5dfd.mp3]""",,Solution [sound:googletts-d09592a2-d3596816-91ab6680-4ff71936-8c7dc63d.mp3],There is an alternative solution.,Es gibt eine alternative Lösung.,
A1-NOUN-1146,A1,,"""<span class=""""die"""">die</span> Luft [sound:googletts-72df9c44-c4c91d5e-8542875b-bd3cec2d-21338b5a.mp3]""",,Air [sound:googletts-a04ed78f-277a7245-dc0723bc-601e959d-15a658cd.mp3],I opened the window to let some air in.,"Ich öffnete das Fenster, um etwas Luft reinlassen.",
